CD_I1002795,Jordan Boyd,3,Snr,43,50,247100,45,Full,D217,D224,,14,10,0, ,"Medium defender picked up in the 2020 mid-season draft, had AFL Fantasy averages in the 60s at VFL level up until last year's 71, so doesn't appear a scorer",none,none,none,175,172,142,none,172,72,-7,-5,93,30, 0 / 7, 0 / 7, 6 / 7, 6 / 7, 0 / 7,0,0,none,none,0,0,none,0,0,none,none,0,0,none,49.85714286,-5,41.75,3,60.66666667,-16,none,none,none,none,53.16666667,-8,49.85714286,49.85714286,zero,none,none,none,none,550,481,none,none,none,none,none,70.93495935,62.60162602,zero,none,none,none,none,0,none,none,none,none,none,none,11.28571429,74.32151182,33.06322529,1.714285714,1.857142857,4.285714286,25.11622807,80.7235179,28.70226389,3.141985646,2.327352472,7.156419458,Intercepts
CD_I1017700,Jesse Motlop,2,Snr,46,55,242700,44,Fair,F217,F240,,10,0,0, ,"Small forward showed plenty in his first season, but that still led to a 44 average such is the role",none,none,none,169,180,193,152,180,71,-4,0,63,16, 0 / 12, 0 / 12, 12 / 12, 12 / 12, 0 / 12,0,0,none,none,0,0,none,0,0,none,none,0,0,none,44.08333333,0,36.66666667,7,46.55555556,-3,41.2,3,none,none,46.63636364,-3,44.08333333,44.08333333,none,none,none,none,none,587,538,none,none,none,none,none,62.38207547,56.60377358,none,none,none,none,none,0,none,none,none,none,none,none,8.333333333,71.02235727,48.2453195,2.083333333,2.416666667,1,20.35798074,70.28924512,43.39027832,3.038980488,4.25614499,1.318991781,Goals
CD_I998180,Bailey Banfield,6,Snr,45,55,233700,42,Fair,F226,F241,,10,14,0, ,"A big ball winner at the lower level, Banfield has mostly played as a defensive forward in the AFL which doesn't generate high scores, especially as sub 10 times",none,none,none,173,188,175,178,87,70,-8,-21,93,0, 0 / 18, 0 / 18, 16 / 18, 15 / 18, 5 / 18,0,0,none,none,0,0,0,0,0,none,none,0,0,0,42.44444444,0,44.45454545,-2,39.28571429,3,20.33333333,22,none,none,44.94117647,-3,63.4,42.44444444,47.66666667,59.6,54.57142857,63.4,none,436,552,459,319,338,228,none,78.66004963,61.85121107,54.83146067,69.37652812,74.51737452,79.65260546,none,-20.95555556,-5.222222222,-11.93333333,5.028571429,-8.828571429,none,none,7.944444444,62.61864679,36.62587685,1.777777778,1.444444444,1,20.35798074,70.28924512,43.39027832,3.038980488,4.25614499,1.318991781,Goals
CD_I1017396,Mac Andrew,2,Snr,52,80,208100,38,Low,D178,D103,,28,11,0,"Former top 5 pick is still very lightly built, but showed some moments in his 4 games last season. Once developed physically, the high leaping Andrew should become a gun ruckman, but until then it looks like he's being trailed as a tall defender. He's suspended to start the season, however as he is still developing, he wouldn't have been relevant anyway.","Suspended to start the season, however as he is still developing, he wouldn't have been relevant anyway",none,none,none,194,188,148,153,188,65,-10,-9,65,33, 0 / 4, 0 / 4, 4 / 4, 4 / 4, 0 / 4,0,0,none,none,0,0,none,0,0,none,none,0,0,none,47.25,-9,none,none,47.25,-9,47.25,-9,none,none,52,-14,47.25,47.25,none,none,none,none,none,570,509,none,none,none,none,none,60.2484472,60.2484472,none,none,none,none,none,0,none,none,none,none,none,none,10.5,79.96031746,42.61294261,2.25,2,4.5,25.11622807,80.7235179,28.70226389,3.141985646,2.327352472,7.156419458,Intercepts
CD_I290314,Lachlan Keeffe,14,Snr,45,45,250000,45,Full,D209,D235,,11,0,0, ,"Versatile big man has become a very reliable defender for the Giants and has also pinched hit in the ruck, but as a defender he's not going to score enough in SuperCoach",none,none,none,173,194,193,165,77,73,5,-24,85,25, 0 / 17, 0 / 17, 17 / 17, 14 / 17, 0 / 17,12,0,none,none,13.94117647,11.64285714,none,0,0,none,none,1.411764706,1.714285714,none,45.41176471,0,39.33333333,6,52.25,-7,40,5,none,none,46.6875,-2,69.38461538,45.41176471,63.125,69.38461538,49.7,40.875,zero,375,526,308,230,367,326,none,76.18243243,47.28682171,54.37415882,49.51435811,49.07407407,45.36082474,zero,-23.97285068,-17.71323529,-6.259615385,19.68461538,8.825,none,none,8,76.48172089,38.78438555,1.882352941,1.941176471,2.411764706,25.11622807,80.7235179,28.70226389,3.141985646,2.327352472,7.156419458,Intercepts
CD_I993820,Tom Cole,8,Snr,54,60,182300,33,Low,D171,D197,,10,0,0, ,"Reliable defender missed 2022 with a serious ankle injury, discounted price but needs to go over 60 to be worthwhile over a rookie which he's only just done 50% of last 4 seasons",none,none,none,204,none,none,none,none,60,none,-33,zero,zero, 0 / 0, 0 / 0, 0 / 0, 0 / 0, 0 / 0,zero,zero,zero,zero,zero,zero,zero,zero,zero,zero,zero,zero,zero,zero,none,none,none,none,none,none,none,none,none,none,none,none,66.26666667,zero,55.19047619,66.26666667,57.35714286,60.66666667,38.75,408,none,393,254,313,243,279,80.16129032,zero,67.35582155,68.9516129,66.93780715,62.55980861,43.87096774,none,none,-11.07619048,8.90952381,-3.30952381,21.91666667,-5.75,none,none,none,none,none,none,25.11622807,80.7235179,28.70226389,3.141985646,2.327352472,7.156419458,Intercepts
CD_I1011243,Callum Jamieson,4,Snr,47,80,251400,46,Fair,R47,R35,,14,28,0, ,"A developing ruck prospect played 9 games in 2022 due to injures, however he still looks a few years off the level",none,none,none,32,33,33,none,33,73,-5,0,72,-4, 0 / 9, 0 / 9, 9 / 9, 8 / 9, 1 / 9,63,26,none,none,37.77777778,34.625,19,0,0,none,none,0,0,0,45.66666667,0,51,-5,35,11,none,none,none,none,51.875,-6,45.66666667,45.66666667,zero,zero,none,none,none,576,522,none,none,none,none,none,69.54314721,61.25211506,zero,zero,none,none,none,0,none,none,none,none,none,none,8.222222222,75.1961927,44.88335738,1.555555556,2.222222222,1.777777778,16.13636364,58.46452845,63.64289849,3.5,2.340909091,11.04545455,HO to Adv
CD_I990816,Aaron Francis,8,Snr,63,78,189400,34,Low,D118/F107,D106/F107,,14,0,0,"The former pick 6 certainly hasn't come on as we all expected him to, and bottomed out last season with just 4 games at senior level. The Swans seem to have a way of getting the best out of players, so there's some home there now that he's made the switch. The 40/50s in the past certainly aren't enough to be a worthy pick, however he has an intercept marking ability that should be able to generate more SuperCoach points than he does. He did average 81 in 5 games in 2018 and anything around that mark would prove a bargain buy. He needs to get a game first, and if he is named Round 1, he could be worth a look at that price.",Hopefully gets a chance at the Swans and if they can get him back to his best he could be a great 'rookie' defender,none,none,none,200,200,186,none,53,62,-7,-47,66,28, 0 / 4, 0 / 4, 4 / 4, 4 / 4, 0 / 4,0,0,none,none,0,0,none,0,0,none,none,0,0,none,43,-9,43,-9,none,none,none,none,none,none,48,-14,80.8,43,55.73333333,59.625,66.41176471,80.8,50,254,545,388,318,237,111,253,102.1491783,50.46728972,57.40740741,67.4796748,68.096204,82.17446271,56.70731707,-37.8,-12.73333333,-3.891666667,-6.786764706,-14.38823529,30.8,-9.666666667,7,67.8030303,27.77777778,2.5,1.5,0.25,25.11622807,80.7235179,28.70226389,3.141985646,2.327352472,7.156419458,Intercepts
CD_I294472,Rory Atkins,11,Snr,45,50,203900,37,Low,D210/M216,D225/M225,,14,18,0, ,"Made the move to the Suns in 2021 in a very strange recruitment, never played more than 8 games since arriving and will unlikely be in their best team again",none,none,none,196,201,93,116,62,64,-15,-40,69,4, 0 / 7, 0 / 7, 7 / 7, 7 / 7, 2 / 7,0,0,none,none,0,0,0,0,0,none,none,10.14285714,10.14285714,3.5,41.14285714,-4,37,0,46.66666667,-10,58,-21,none,none,47.33333333,-10,77.2,41.14285714,45.625,50.5,75.5,76.6,77.2,296,555,468,385,163,146,113,94.37652812,73.88059701,57.24770642,65.25735294,96.1038961,95.34050179,97.67726161,-36.05714286,-4.482142857,-4.875,-25,-1.1,-0.6,3.033333333,12.71428571,64.39039731,28.71533229,2.428571429,1.142857143,1.857142857,25.11622807,80.7235179,28.70226389,3.141985646,2.327352472,7.156419458,Intercepts
CD_I1008159,Will Hamill,5,Snr,50,60,284000,52,Full,D188,D198,,14,0,0, ,"I liked the look of the running defender when he first started, but max average of 40 and just 12 games last season doesn't read well",none,none,none,148,168,169,169,168,79,5,0,80,9, 0 / 12, 0 / 12, 12 / 12, 9 / 12, 1 / 12,0,0,none,none,0,0,0,0,0,none,none,1.083333333,1.444444444,0,51.58333333,0,57,-5,47.71428571,4,31,21,none,none,55.45454545,-3,51.58333333,51.58333333,42.94117647,39.25,zero,none,none,541,467,482,421,none,none,none,74.48856799,55.71600481,54.2218543,63.8667992,zero,none,none,0,8.642156863,3.691176471,none,none,none,none,10.25,86.02605728,39.82201894,1.333333333,2,4.75,25.11622807,80.7235179,28.70226389,3.141985646,2.327352472,7.156419458,Intercepts
CD_I1012833,Eddie Ford,3,Snr,48,60,123900,23,Low,F208,F220,,14,0,0, ,Strong marking forward who only played 2 games last season and a 63 VFL AF average isn't great,none,none,none,222,215,211,none,164,50,-10,-25,33,16, 0 / 2, 0 / 2, 2 / 2, 2 / 2, 0 / 2,0,0,none,none,0,0,none,0,0,none,none,0,0,none,24.5,-2,24.5,-2,none,none,none,none,none,none,33,-10,47.5,24.5,47.5,none,none,none,none,567,591,460,none,none,none,none,56.88622754,46.5648855,60.17964072,none,none,none,none,-23,-23,none,none,none,none,none,6,83.33333333,36.66666667,1.5,1,0.5,20.35798074,70.28924512,43.39027832,3.038980488,4.25614499,1.318991781,Goals
CD_I1005988,Liam Henry,4,Snr,51,70,202300,37,Low,M205/F195,M203/F157,,7,14,0,"Highly rated by those who have seen a lot of him. He's yet to show much to date, however he's spent most his time playing as a small forward and is tipped to play more on the wing in 2023, where he can use his elite leg speed and evasiveness. The former top 10 pick should see a bump in scoring if that eventuates, I just cant see it improving by enough based on exposed form. ","Training as a wing which is better than a small forward, but I cant see him improving by enough based on exposed form",none,none,none,189,191,149,159,189,64,-13,-5,66,10, 0 / 6, 0 / 6, 6 / 6, 6 / 6, 1 / 6,0,0,none,none,0,0,0,0,0,none,none,0,0,0,40.83333333,-4,30.5,7,46,-9,39.33333333,-2,none,none,47,-10,42,40.83333333,42,34.33333333,none,none,none,596,556,489,435,none,none,none,66.41221374,66.41221374,51.93861066,63.3640553,none,none,none,-1.166666667,-1.166666667,7.666666667,none,none,none,none,10.83333333,73.34485504,33.86039886,2.333333333,1.666666667,0.166666667,20.35798074,70.28924512,43.39027832,3.038980488,4.25614499,1.318991781,Goals
CD_I1006533,Riley Garcia,4,Snr,52,70,212200,39,Low,F189,F158,,14,10,0, ,"Was recruited as a hard-running midfielder, but been used as a small forward when at AFL level and hard to see him changing that ",none,none,none,182,185,172,138,154,66,-10,-11,61,11, 0 / 6, 0 / 6, 6 / 6, 6 / 6, 1 / 6,0,0,none,none,0,0,0,0,0,none,none,0,0,0,42.83333333,-4,11,28,49.2,-10,48,-9,none,none,49.2,-10,49.66666667,42.83333333,49.66666667,zero,none,none,none,553,548,441,none,none,none,none,71.4057508,62.44019139,61.02236422,zero,none,none,none,-6.833333333,-6.833333333,none,none,none,none,none,12.66666667,73.40012928,43.62493715,2.833333333,1.333333333,0.5,20.35798074,70.28924512,43.39027832,3.038980488,4.25614499,1.318991781,Goals
CD_I1020594,Jye Amiss,2,Snr,57,90,247800,45,Low,F153,F46,,11,28,0,"Promising key forward who showed some great signs in his limited games. I think he'll become a very good player, but young key forwards are never good Fantasy options",Young key forwards are never good SuperCoach options,none,none,none,166,92,176,none,92,72,-6,-17,75,48, 0 / 3, 0 / 3, 3 / 3, 2 / 3, 0 / 3,0,0,none,none,0,0,none,0,0,none,none,0,0,none,75,-30,75,-30,none,none,none,none,56,-11,69.5,-25,62.33333333,62.33333333,none,none,none,none,none,449,340,none,none,none,none,none,76.01626016,61.78861789,none,none,none,none,none,0,none,none,none,none,none,none,9.333333333,62.43386243,56.94444444,1,0.666666667,1.333333333,20.35798074,70.28924512,43.39027832,3.038980488,4.25614499,1.318991781,Goals
CD_I294092,Anthony McDonald-Tipungwuti,8,Snr,52,58,209600,38,Low,F190,F233,,28,10,0, ,Great to see Tippa back! But will need some time getting to fitness and never been a SuperCoach asset as a small forward,none,none,none,184,none,none,none,none,65,none,-37,zero,zero, 0 / 0, 0 / 0, 0 / 0, 0 / 0, 0 / 0,zero,zero,zero,zero,zero,zero,zero,zero,zero,zero,zero,zero,zero,zero,none,none,none,none,none,none,none,none,none,none,none,none,75.4,zero,63.45,68.9,75.4,67.9,73.8,315,none,302,234,164,192,130,97.36147757,zero,67.625,70.14134276,79.37118672,83.56687898,88.52242744,none,none,-5.45,-6.5,7.5,-5.9,1.6,none,none,none,none,none,none,20.35798074,70.28924512,43.39027832,3.038980488,4.25614499,1.318991781,Goals
CD_I1006087,Caleb Graham,5,Snr,39,50,321500,58,Overs,D225,D226,,11,14,0, ,56 VFL AF average and 4 sub 60 seasons at AFL level sums him up,none,none,none,126,136,203,102,136,86,37,0,87,20, 0 / 15, 0 / 15, 15 / 15, 11 / 15, 0 / 15,0,0,none,none,0.333333333,0.454545455,none,0,0,none,none,0,0,none,58.4,0,54.4,4,60.4,-2,63.8,-6,none,none,61.14285714,-3,58.4,58.4,43.83333333,53,54.66666667,none,none,487,386,477,371,337,none,none,64.64944649,41.84501845,45.08790072,42.08754209,50.18315018,none,none,0,14.56666667,-9.166666667,-1.666666667,none,none,none,8.866666667,81.56920857,38.67092167,1.733333333,0.933333333,4.466666667,25.11622807,80.7235179,28.70226389,3.141985646,2.327352472,7.156419458,Intercepts
CD_I1002242,Charlie Constable,6,Snr,63,75,123900,23,Low,D119/M157,D122/M181,,14,0,0,"Constable was delisted from Geelong at the end of 2021 and was thrown a lifeline by Gold Coast, however he didnt see much more AFL action with just the 1 game in 2022 (as sub). Constable has been a strong VFL player over his career, averaging 100 AF last season and 111 in 2021. He averaged 80 from 7 games in 2019 at the top level (his debut year), so he can obviously find the football. It's a question on if he is best 22  Gold Coast bat deep in the midfield and hell likely find it tough again. ","Great VFL numbers but has very been able to get a decent crack at AFL level, unlikely to change this season",none,none,none,217,209,1,172,55,50,-20,-57,6,6, 0 / 1, 0 / 1, 1 / 1, 1 / 1, 1 / 1,0,0,none,none,0,0,0,9,9,none,none,9,9,9,6,17,none,none,6,17,6,17,none,none,none,none,80,6,49,62,80,zero,none,270,600,446,284,129,none,none,180,180,140,133.6206897,121.3135327,zero,none,-74,-43,-13,-18,none,none,none,4,75,0,1,0,0,25.11622807,80.7235179,28.70226389,3.141985646,2.327352472,7.156419458,Intercepts
CD_I1002220,Esava Ratugolea,7,Snr,50,75,174000,32,Low,F201/R44,F124/R41,,11,14,0, ,"Just 4 games last season so he comes in very cheap, yet to cement himself in the team but if he does, he could prove a decent cash generator if he gets back to high-60s",none,none,none,205,197,212,166,65,59,-5,-37,56,24, 0 / 4, 0 / 4, 4 / 4, 4 / 4, 0 / 4,26,19,none,none,15,15,none,0,0,none,none,0,0,none,39.5,-8,41,-9,35,-3,35,-3,none,none,44.66666667,-13,68.75,39.5,51.78571429,68.75,61.25,54.375,zero,382,563,427,235,281,286,none,87.3015873,45.27027027,56.89354276,76.98412698,70.09602195,69.53455571,zero,-29.25,-12.28571429,-16.96428571,7.5,6.875,none,none,6.5,72.15909091,50.9469697,1.5,2,0,20.35798074,70.28924512,43.39027832,3.038980488,4.25614499,1.318991781,Goals
CD_I1009383,Trey Ruscoe,4,Snr,49,60,233400,42,Low,D195,D199,,14,0,0, ,"Started his career as a forward but moved to defense, however scoring and position in team still not solid",none,none,none,181,164,114,none,164,70,-11,-11,56,51, 0 / 3, 0 / 3, 3 / 3, 3 / 3, 0 / 3,0,0,none,none,0,0,none,0,0,none,none,0,0,none,53,-11,none,none,53,-11,none,none,none,none,54,-12,53,53,47.77777778,38.5,none,none,none,529,457,458,424,none,none,none,75,66.98113208,71.42857143,55.86080586,none,none,none,0,5.222222222,9.277777778,none,none,none,none,11,73.29059829,45.23809524,0.333333333,1.666666667,5.666666667,25.11622807,80.7235179,28.70226389,3.141985646,2.327352472,7.156419458,Intercepts
CD_I1004940,Sam Simpson,7,Snr,45,50,166100,30,Low,M217/F227,M226/F250,,14,0,0,0,"Simpson burst on the scene with a 112 in Round 6 2020, but struggled since and didn't play a game last season",none,none,none,210,none,none,none,none,57,none,-44,zero,zero, 0 / 0, 0 / 0, 0 / 0, 0 / 0, 0 / 0,zero,zero,zero,zero,zero,zero,zero,zero,zero,zero,zero,zero,zero,zero,none,none,none,none,none,none,none,none,none,none,none,none,74,zero,59.25,74,zero,28,42.6,331,none,348,192,none,337,277,99.7005988,zero,84.58498024,92.44011976,zero,45.85798817,57.35080058,none,none,-14.75,46,none,-14.6,none,none,none,none,none,none,none,20.35798074,70.28924512,43.39027832,3.038980488,4.25614499,1.318991781,Goals
CD_I993797,Tom Wilson,4,Snr,48,60,210000,38,Low,D200/F209,D200/F221,,14,0,0, ,"Former Australian basketballer has been putting up decent VFL numbers, but opportunites at AFL level seem limited",none,none,none,192,161,125,none,161,65,-12,-17,68,41, 0 / 2, 0 / 2, 2 / 2, 2 / 2, 0 / 2,0,0,none,none,0,0,none,0,0,none,none,0,0,none,54.5,-17,54.5,-17,none,none,none,none,none,none,68,-30,54.5,54.5,40.75,zero,none,none,none,520,443,495,none,none,none,none,73.64864865,65.54054054,52.88135593,zero,none,none,none,0,13.75,none,none,none,none,none,11.5,83.48214286,37.94642857,3,1,0.5,25.11622807,80.7235179,28.70226389,3.141985646,2.327352472,7.156419458,Intercepts
CD_I1005150,Emerson Jeka,4,Snr,53,65,211400,38,Low,D175/F183,D171/F191,,11,14,0, ,"Developing key forward should geg more chances this year, but 55 AF at VFL level doesn't suggest he's going to be a scorer",none,none,none,191,184,147,150,184,66,-10,-10,68,25, 0 / 3, 0 / 3, 3 / 3, 3 / 3, 1 / 3,0,0,none,none,0,0,0,0,7,none,none,2.333333333,2.333333333,7,48,-10,none,none,48,-10,48,-10,none,none,59.5,-22,48,48,35,zero,none,none,none,563,503,508,none,none,none,none,63.15789474,60.52631579,36.22291022,zero,none,none,none,0,13,none,none,none,none,none,11.33333333,82.08333333,37.77056277,3.333333333,1,5.333333333,25.11622807,80.7235179,28.70226389,3.141985646,2.327352472,7.156419458,Intercepts
CD_I281078,Liam Jones,13,Snr,61,69,228100,41,Low,D127,D156,,11,0,0, ,"Back from a year away and if he can get back to his 70s he'll be an okay selection, I don't like to trust key position players though",none,none,none,184,none,none,none,none,69,none,-37,none,none, 0 / 0, 0 / 0, 0 / 0, 0 / 0, 0 / 0,none,none,none,none,none,none,none,none,none,none,none,none,none,none,none,none,none,none,none,none,none,none,none,none,none,none,77.5,none,69.05263158,72.11764706,66.07692308,70.47058824,77.5,294,none,250,207,240,181,111,80.47767394,none,54.24476295,50.97462871,49.27099045,56.32432432,56.07476636,none,none,-3.06501548,6.040723982,-4.393665158,-7.029411765,18.75,none,none,none,none,none,none,25.11622807,80.7235179,28.70226389,3.141985646,2.327352472,7.156419458,Intercepts
CD_I1004995,Jordon Butts,5,Snr,52,59,280500,51,Fair,D179,D206,,11,0,0, ,"23-year-old full back has cemented himself as the main man in deep defence for the Crows, far from a scorer though",none,none,none,150,170,204,144,147,78,24,-6,75,23, 0 / 19, 0 / 19, 19 / 19, 18 / 19, 0 / 19,0,0,none,none,0,0,none,0,0,none,none,0,0,none,50.94736842,0,50.66666667,0,51.2,0,50.8,0,none,none,52.5,-2,57,50.94736842,57,47,zero,none,none,496,474,369,402,none,none,none,62.51246261,40.76054664,47.85643071,40.48295455,zero,none,none,-6.052631579,-6.052631579,10,none,none,none,none,9.526315789,83.34257847,39.60773145,1.263157895,0.789473684,5.421052632,25.11622807,80.7235179,28.70226389,3.141985646,2.327352472,7.156419458,Intercepts
CD_I1002251,Brent Daniels,6,Snr,52,65,191300,35,Low,F191,F192,,10,0,0, ,"Missed the entire 2022 season for injury and they missed him up forward, however scoring limited in the small forward role and no an option despite the discount",none,none,none,196,none,none,none,none,62,none,-31,zero,zero, 0 / 0, 0 / 0, 0 / 0, 0 / 0, 0 / 0,zero,zero,zero,zero,zero,zero,zero,zero,zero,zero,zero,zero,zero,zero,none,none,none,none,none,none,none,none,none,none,none,none,66.375,zero,57.92307692,66.375,65.53846154,50.42857143,none,405,none,364,253,247,303,none,87.61826409,zero,71.95253506,73.91219891,81.08802962,60.37463977,none,none,none,-8.451923077,0.836538462,15.10989011,none,none,none,none,none,none,none,none,20.35798074,70.28924512,43.39027832,3.038980488,4.25614499,1.318991781,Goals
CD_I1006144,Ben King,5,Snr,46,70,176300,32,Low,F218,F159,,11,28,0, ,"Returning from an ACL, will need time to find his feet and even at his best, the star forward isn't a SuperCoach option",none,none,none,201,none,none,none,none,59,none,-24,zero,zero, 0 / 0, 0 / 0, 0 / 0, 0 / 0, 0 / 0,zero,zero,zero,zero,zero,zero,zero,zero,zero,zero,zero,zero,zero,zero,none,none,none,none,none,none,none,none,none,none,none,none,55.58823529,zero,53.36363636,55.58823529,41.42857143,none,none,509,none,410,356,388,none,none,60.11450382,zero,56.28140704,52.00381679,50.36630037,none,none,none,none,-2.22459893,14.15966387,none,none,none,none,none,none,none,none,none,20.35798074,70.28924512,43.39027832,3.038980488,4.25614499,1.318991781,Goals
CD_I997254,Nathan Kreuger,5,Snr,35,65,192300,35,Full,F256,F193,,21,11,0, ,Set to miss the start of the season after a shoulder recon in December,none,none,none,195,207,153,none,145,62,-13,-17,78,5, 0 / 5, 0 / 5, 5 / 5, 4 / 5, 3 / 5,0,0,none,none,3.4,4.25,3,0,0,none,none,0,0,0,43.66666667,-9,43.66666667,-9,none,none,none,none,18,17,40.5,-6,52,33.4,52,zero,zero,none,none,536,580,425,none,none,none,none,73.89380531,65.92920354,52.63157895,zero,zero,none,none,-18.6,-18.6,none,none,none,none,none,4.4,59.33333333,22.30769231,1,1.4,0.8,20.35798074,70.28924512,43.39027832,3.038980488,4.25614499,1.318991781,Goals
CD_I1020968,Jackson Archer,2,Snr,54,74,214400,39,Low,D172,D132,,10,0,0, ,"Looked good in his 3 games last season and creating a lot of buzz internally this preseason, but VFL average of 33 AF and AFL 49 SC doesn't suggest he's a scorer",none,none,none,190,179,173,158,179,66,-6,-10,57,43, 0 / 3, 0 / 3, 3 / 3, 3 / 3, 0 / 3,0,0,none,none,0,0,none,0,0,none,none,0,0,none,48.66666667,-10,none,none,48.66666667,-10,44.5,-6,none,none,51.5,-13,48.66666667,48.66666667,none,none,none,none,none,560,495,none,none,none,none,none,59.59183673,54.69387755,none,none,none,none,none,0,none,none,none,none,none,none,11,80,49.82905983,2.333333333,3.333333333,4.666666667,25.11622807,80.7235179,28.70226389,3.141985646,2.327352472,7.156419458,Intercepts
CD_I1010708,Sam Butler,7,Snr,45,80,197600,36,Low,F228,F93,,10,0,0,"The younger brother of Dan, Sam is slightly taller and more able to push up through the midfield. Played 9 games in his debut season as a forward and creating some buzz internally this preseason, but if he remains in his forward role he's unlikley to score enough.","Creating some buzz internally this preseason, but if he remains in his forward role he's unlikley to score enough",none,none,none,193,205,203,171,26,63,-6,-46,49,18, 0 / 9, 0 / 9, 9 / 9, 9 / 9, 0 / 9,0,0,none,none,0,0,none,0,0,none,none,0,0,none,35.88888889,0,39.8,-4,31,5,31.5,5,none,none,38.125,-2,81.92307692,35.88888889,none,none,none,none,58,240,578,none,none,none,none,225,95.39227895,51.41955836,none,none,none,none,69.70849176,-46.03418803,none,none,none,none,none,-4.55,8.444444444,67.68755935,49.9382716,2.333333333,1.666666667,0.666666667,20.35798074,70.28924512,43.39027832,3.038980488,4.25614499,1.318991781,Goals
CD_I1012819,Josh Treacy,3,Snr,52,65,200400,36,Low,F192,F194,,11,14,0, ,"Ferocious key forward should get more chances with no Lobb, but not a Fantasy scorer",none,none,none,190,172,214,none,172,64,-2,-10,75,31, 0 / 4, 0 / 4, 4 / 4, 3 / 4, 0 / 4,0,0,none,none,0,0,none,0,0,none,none,0,0,none,45.5,-10,45.5,-10,none,none,none,none,none,none,50.33333333,-14,45.5,45.5,44.2,none,none,none,none,578,524,474,none,none,none,none,53.68731563,44.54277286,49.68992248,none,none,none,none,0,1.3,none,none,none,none,none,7.75,67.08333333,55.54487179,3.25,2.25,0.25,20.35798074,70.28924512,43.39027832,3.038980488,4.25614499,1.318991781,Goals
CD_I1009291,Isiah Winder,3,Snr,40,47,176200,32,Low,F245,F254,,6,14,0, ,WAFL AF average of 66 and an off season incident makes him an unlikely Round 1 starter,none,none,none,202,194,195,none,194,59,-10,-8,77,23, 0 / 5, 0 / 5, 5 / 5, 4 / 5, 0 / 5,0,0,none,none,0,0,none,0,0,none,none,0,0,none,40,-8,40,-8,none,none,none,none,none,none,44.25,-12,40,40,31,none,none,none,none,602,560,513,none,none,none,none,55.70652174,55.70652174,46.42857143,none,none,none,none,0,9,none,none,none,none,none,10,74.33333333,40.66666667,2,1.4,0.6,20.35798074,70.28924512,43.39027832,3.038980488,4.25614499,1.318991781,Goals
CD_I1009708,Jack Buckley,6,Snr,44,65,205000,37,Low,D214,D172,,11,14,0, ,"Key defender returning from an ACL, will need time to get back to his best which isn't high SuperCoach scoring anyway",none,none,none,195,none,none,none,none,65,none,-25,zero,zero, 0 / 0, 0 / 0, 0 / 0, 0 / 0, 0 / 0,zero,zero,zero,zero,zero,zero,zero,zero,zero,zero,zero,zero,zero,zero,none,none,none,none,none,none,none,none,none,none,none,none,62.06666667,zero,62.06666667,59.5,zero,zero,none,451,none,317,322,none,none,none,76,zero,61.14285714,70.98765432,zero,zero,none,none,none,2.566666667,none,none,none,none,none,none,none,none,none,none,25.11622807,80.7235179,28.70226389,3.141985646,2.327352472,7.156419458,Intercepts
