CD_I1012013,Nic Martin,2,Snr,82,92,436000,79,Fair,M83/F27,M107/F37,,3,7,0,"I don't think anyone saw Nic Martin's debut season coming. The mature aged recruit who trained with West Coast in the preseason before signing with Essendon, averaged 76 Fantasy points in the WAFL the year prior and came out and averaged 79 at AFL level, including a 114 on debut. He still looked very raw despite being mature aged and the with amount he improved with less than 1 preseason, I think he'll greatly benefit from a full preseason. However, as an outside wingman, I doubt he could improve enough to be Fantasy relevant this season. He retained his forward status which is handy but at his price he will need to be around the top 6 forwards to be a worthwhile selection, and I doubt that's going to happen.",Great debut season and should improve again but scoring is capped as an outside wingman so I doubt he'll challenge the top 6,none,none,none,32,33,29,39,33,107,2,0,114,49, 0 / 21, 2 / 21, 13 / 21, 7 / 21, 0 / 21,0,0,none,0,0.692307692,0.857142857,none,0,0,none,0,0.615384615,1.142857143,none,79.19047619,0,83.4,-4,75.36363636,4,77.6,1,none,none,80.7,-2,79.19047619,79.19047619,none,none,none,none,none,276,174,none,none,none,none,none,90.63852814,90.63852814,none,none,none,none,none,0,none,none,none,none,none,none,19.9047619,76.37725868,25.71863015,2.238095238,1.666666667,0.904761905,20.35798074,70.28924512,43.39027832,3.038980488,4.25614499,1.318991781,Goals
CD_I992128,Ryan Burton,8,Snr,82,85,455000,83,Full,D56,D72,,3,29,0,"After averaging 84 in his second season, Burton looked to be a star Fantasy defender of the future. He hasn't matched that average since in 5 seasons. Unfortunately, he hasn't come on and you can't take the risk on him turning it around this year.",Hasn't come on as I though he was going to after his 84 average in year 2,none,none,none,46,44,32,53,42,110,-1,-1,120,50, 0 / 22, 6 / 22, 14 / 22, 7 / 22, 0 / 22,0,0,none,0,0,0,none,39,22,none,56.33333333,37.5,41,none,82.63636364,0,84.72727273,-2,80.54545455,2,79,4,none,none,84.19047619,-1,83.7,82.63636364,75.25,55.875,74,66.08695652,83.7,221,148,197,355,176,203,79,104.3723554,98.36987071,96.40914037,96.13502935,101.9922426,78.25537295,98.48308051,-1.063636364,7.386363636,19.375,-18.125,7.913043478,-17.61304348,38.95,20.31818182,77.43236358,26.48527322,2.227272727,1.954545455,4.954545455,25.11622807,80.7235179,28.70226389,3.141985646,2.327352472,7.156419458,Intercepts
CD_I270896,Trent Cotchin,16,Snr,75,75,454500,83,Overs,M105,M175,,3,18,20,"Cotchin plays a perfect team game for the Tigers and as a result, hasn't been a factor in SuperCoach for a number of years now. Certainly not an option this year, especially considering hell likely lose midfield time to Hopper and Taranto.",Hasn't had a SuperCoach game for 5 years now,none,none,none,63,64,62,29,6,110,-4,-33,124,47, 2 / 19, 5 / 19, 10 / 19, 9 / 19, 0 / 19,76,56,64.5,72,73.8,73.44444444,none,0,0,0,0,0,0,none,82.55555556,0,77.6,5,88.75,-6,98.8,-16,56,27,83.05555556,0,116.2727273,81.15789474,77.8125,81.70588235,77.42857143,89.95454545,100.72,25,158,174,134,148,65,21,138.5848954,102.0547945,104.796748,111.7408907,98.79275654,104.9543677,119.7994987,-35.11483254,3.345394737,-3.893382353,4.277310924,-12.52597403,-10.76545455,0.22,22.68421053,60.14142378,48.80358285,3.789473684,2.842105263,5,28.83718956,70.44127769,46.78371283,3.968325922,5.324824605,6.468673419,Clearances
CD_I994185,Jordan De Goey,9,Snr,89,96,468700,85,Fair,M66,M84,,3,13,5,"De Goey burst into SuperCoach relevance in 2021 when he was shifted into the midfield and averaged 110 for the second half of the season. McRae kept him in there for the full season, attending 77% of the CBAs, however never met those scoring heights, averaging 85 for the regular season. It was a mixture of both McRae's low possession game style and the focus for De Goey to get his possessions in a dangerous position forward of centre. We might see him spend a bit more time forward as the Pies' midfield depth should be deeper with Tom Mitchell and hopefully Adams rotating in there, so I doubt we'll see the 100+ De Goey again under McRae. As a mid-only option, he's certainly not one to consider starting with.",First full season as a midfeilder however McRae's lower possession game plan and focus to get the ball forward of centre means he might not be that 100+ player again,none,none,none,58,48,81,44,48,112,6,-5,145,44, 3 / 19, 5 / 19, 11 / 19, 4 / 19, 0 / 19,91,57,86,81.4,75.63636364,68.5,none,0,0,0,0,0,0,none,85.125,0,86.83333333,-2,80,5,92,-7,116.6666667,-32,92.66666667,-8,90.10526316,90.10526316,85.15,77.9,82.41176471,85.66666667,79,181,101,123,168,110,86,103,106.0640472,93.84146341,101.0791367,82.18390805,102.884397,97.16748768,97.54601227,0,4.955263158,7.25,-4.511764706,-3.254901961,6.666666667,3.35,20.78947368,68.40644278,48.4534112,3.789473684,3.473684211,5.105263158,28.83718956,70.44127769,46.78371283,3.968325922,5.324824605,6.468673419,Clearances
CD_I295067,James Aish,10,Snr,81,83,431800,78,Fair,M86,M150,,3,10,5,"Aish has become a reliable role player for Freo, playing a range of positions which included being a tagger in 2022 but mainly as a wingman. He's a mid 70s type player, which certainly doesn't make him relevant in SuperCoach, particularly as a mid-only.",Versatile role player not one for SuperCoach,none,none,none,67,71,74,51,71,106,-3,2,120,36, 0 / 23, 4 / 23, 17 / 23, 8 / 23, 0 / 23,81,0,none,21.75,15.52941176,22.375,none,0,0,none,0,0.588235294,0,none,78.42857143,0,74.91666667,3,83.11111111,-5,88,-10,51,27,77.86363636,0,76.04347826,76.04347826,68.18181818,75.3125,63.21428571,64,56.875,308,197,257,183,266,221,232,95.82881907,95.82881907,83.81788261,92.71460843,83.59246387,85.34161491,85.14442916,0,7.861660079,-7.130681818,12.09821429,-0.785714286,7.125,-5.725,20.82608696,68.93913584,31.23786617,2.695652174,2.434782609,2.304347826,28.83718956,70.44127769,46.78371283,3.968325922,5.324824605,6.468673419,Clearances
CD_I294199,Sam Menegola,12,Snr,75,70,344000,62,Low,M106,M191,,3,7,14,"Once a relevant SuperCoach forward fell out of favour last season, playing just the 7 games at an average of 68. Now 31, it's likely he'll struggle for games again, especially considering Geelong's off season recruiting.",Will likely struggle for games again,none,none,none,103,86,70,55,16,90,-16,-45,95,14, 0 / 7, 0 / 7, 5 / 7, 2 / 7, 1 / 7,3,0,none,none,8.2,8.5,0,0,0,none,none,0,0,0,69.42857143,-7,none,none,69.42857143,-7,86,-24,none,none,78.66666667,-17,106.952381,69.42857143,90.5,106.952381,81.41666667,98.17391304,98.36363636,62,247,85,25,118,36,29,130.4577465,98.13278008,106.6702241,120.0424929,99.26311227,121.7228464,129.6675192,-37.52380952,-21.07142857,-16.45238095,25.53571429,-16.75724638,-0.18972332,5.738636364,17.85714286,72.78749905,36.87947141,3.714285714,1.142857143,1.285714286,28.83718956,70.44127769,46.78371283,3.968325922,5.324824605,6.468673419,Clearances
CD_I994386,Tom Atkins,5,Snr,91,94,461200,84,Low,D32/M61,D48/M106,,3,12,10,"Moved into the midfield with great team impact in 2022, highlighted by his strong tackle pressure. He had a small bump in output (80 pre bye on 15% CBAs to 88 post when CBAs went to 59%) but 88 is still not enough to be a relevant defender. Should improve again with Selwood out, but I think he's one of those who is too team orientated to make a impact in SuperCoach.",Pressure midfielder who is too team orientated to make an impact in SuperCoach,none,none,none,41,39,24,60,39,111,-4,-1,119,41, 0 / 25, 5 / 25, 16 / 25, 3 / 25, 0 / 25,60,43,none,52.8,31.6875,35,none,0,0,none,0,1.25,0,none,83.77272727,0,80.33333333,4,87.9,-4,76,8,91.66666667,-8,86.54166667,-3,84.72,84.72,72.9047619,56.33333333,60.60869565,none,none,212,135,214,351,287,none,none,112.0042306,103.595981,79.15523862,66.20111732,67.09005048,none,none,0,11.8152381,16.57142857,-4.275362319,none,none,none,18.08,71.75199338,45.59551745,2.72,6.28,4.52,25.11622807,80.7235179,28.70226389,3.141985646,2.327352472,7.156419458,Intercepts
CD_I1000981,Daniel Rioli,8,Snr,98,104,507000,92,Low,D19,D19,,3,0,0,"Rioli was a revelation in 2022, switching to half back and becoming a star running defender of the comp. The move improved his Fantasy output by 30 points per game to finish with 92 for the season. There's no question he'll remain in the role, even if Short moves back again, but he'll unlikely push that average to the mark needed to be a relevant defender this season.",Starred down back and will remain in that role but unlikely push that average to the mark needed to be a relevant defender,none,none,none,22,22,38,18,22,119,12,0,129,64, 2 / 23, 9 / 23, 11 / 23, 3 / 23, 0 / 23,0,0,0,0,0,0,none,30,16.66666667,22,14.44444444,16.27272727,16.66666667,none,92.09090909,0,86.45454545,6,97.72727273,-6,96.4,-4,88,4,96.1,-4,91.91304348,91.91304348,61.82352941,65.83333333,60.31818182,63.75,63.16,166,84,321,260,293,223,191,112.4468085,95.79787234,75.41229385,79.47530864,66.82867558,81.13440197,66.17466175,0,30.08951407,-4.009803922,5.515151515,-3.431818182,0.59,11.93777778,20.47826087,84.65925848,28.4222296,2.086956522,2.347826087,5.652173913,25.11622807,80.7235179,28.70226389,3.141985646,2.327352472,7.156419458,Intercepts
CD_I991930,Darcy Byrne-Jones,10,Snr,83,85,460400,84,Full,D53,D73,,3,0,0,"Byrne-Jones has been a 70s/80s guy for the past 5 seasons. That's about him I think, so he's not worth considering in Fantasy.",A 70s/80s defender,none,none,none,42,42,33,41,36,111,1,-3,117,56, 0 / 21, 6 / 21, 13 / 21, 6 / 21, 0 / 21,0,0,none,0,0,0,none,0,0,none,0,2.461538462,3.833333333,none,83.61904762,0,78.81818182,5,88.9,-5,83.2,1,none,none,85,-1,87.2,83.61904762,75.08333333,82.2,87.2,71.8,64.4,192,143,201,131,84,168,184,104.6483909,98.15256257,95.17133956,92.19634991,102.8679654,85.74850299,79.4047619,-3.580952381,8.535714286,-7.116666667,-5,15.4,7.4,0.6,21.71428571,75.58640521,29.88363842,3.285714286,1.857142857,6.761904762,25.11622807,80.7235179,28.70226389,3.141985646,2.327352472,7.156419458,Intercepts
CD_I1005521,Oscar McInerney,7,Snr,93,94,487000,88,Low,R12,R18,,3,0,0,"The Big O has become a solid ruck, averaging 88 for the past 3 seasons. While solid, he's had the number 1 mantle at the Lions for long enough to know that he's never going to challenge the top few in SuperCoach.",Averaged 88 since being the number 1 ruck,none,none,none,12,15,13,10,9,116,6,-7,142,6, 2 / 22, 7 / 22, 12 / 22, 6 / 22, 1 / 22,63,3,69,75.57142857,64.25,62.16666667,3,0,0,0,0,0,0,0,88.45,0,86.83333333,1,90.875,-3,90.8,-3,58,30,89.47619048,-1,94.56521739,85.68181818,94.56521739,83.21052632,67.47619048,58.5,zero,143,128,61,126,225,264,none,114.5339652,97.37302977,93.83886256,93.85354539,74.62877624,67.00125471,zero,-8.883399209,-8.883399209,11.35469108,15.73433584,8.976190476,none,none,11.81818182,61.88090023,65.30314366,2.409090909,2.909090909,8.181818182,16.13636364,58.46452845,63.64289849,3.5,2.340909091,11.04545455,HO to Adv
CD_I296351,Jack Billings,10,Snr,90,92,405400,74,Low,M64,M108,,3,5,0,"The former number three pick looked set to fulfill his potential in 2019, pushing up the ground to average 99 points per game, including 106 in the last half. Unfortunately, he hasn't gone on with it, dropping his average in every season since to finish on 75 last year. At 27, he should be in his prime and may appear underpriced to what he could produce. However, Billings needs two things to be relevant in Fantasy; forward status and CBAs. Unfortunately, he's available mid-only and attended no centre bounces last season.",Reduced his averaged every year since 2019,none,none,none,78,76,50,113,40,101,-15,-20,105,0, 0 / 8, 1 / 8, 6 / 8, 2 / 8, 1 / 8,0,0,none,0,0,0,0,0,0,none,0,0,0,0,73.625,0,68,6,75.5,-2,0,74,none,none,84.14285714,-10,93.81818182,73.625,81.82352941,93.42105263,93.81818182,80.61904762,92.68181818,148,216,152,81,64,112,44,109.1658636,108.8447653,98.7483531,106.8807339,111.1738149,98.72537659,111.4252061,-20.19318182,-8.198529412,-11.59752322,-0.397129187,13.1991342,-12.06277056,17.74064171,17,65.27101371,23.77780361,1.5,2.375,1,28.83718956,70.44127769,46.78371283,3.968325922,5.324824605,6.468673419,Clearances
CD_I1005054,Josh Daicos,7,Snr,75,95,428900,78,Full,M107,M89,,3,7,0,"Daicos has been used predominantly as a wingman, which isn't a great role for SuperCoach scoring with the lack of contested possessions on the outside. He saw some CBAs in the back half of 2022, averaging 22% post bye, and naturally improved his average to 89 from 71. The Pies were light on for inside mids, but with Tom Mitchell's arrival and a healthy Taylor Adams, I expect Daicos to move back to his wing role, which means he'll be capped with his scoring output in 2023.",Scoring is limited when on the wing which is where he'll likely play in 2023,none,none,none,68,69,88,48,66,105,1,-2,124,25, 1 / 25, 2 / 25, 15 / 25, 8 / 25, 0 / 25,36,0,36,18,8.6,7.75,none,0,0,0,0,0,0,none,77.90909091,0,70.53846154,7,88.55555556,-11,89.4,-11,74.33333333,4,79.66666667,-2,80.38888889,77.48,67.88235294,80.38888889,53,59.1,49.5,262,185,260,151,349,261,256,95.00984898,91.06067624,90.11887073,100.2954695,88.26815642,92.54742547,83.10055866,-2.908888889,9.597647059,-12.50653595,27.38888889,-6.1,9.6,none,21.08,69.45152453,31.34424217,3.48,2.6,2.28,28.83718956,70.44127769,46.78371283,3.968325922,5.324824605,6.468673419,Clearances
CD_I291748,Brodie Smith,13,Snr,79,80,450200,82,Full,D65,D90,,3,29,0,"Smith has been a consistent defender for a number of years now without taking that next step and being a Fantasy relevent one. His kick-ins are low for someone with such a nice kick (only 31%) as he's made way for Dawson to be the main man back there. While Dawson is playing in defence, I doubt we'll see Smith pushing that average much higher.","While Dawson is playing in defence, I doubt we'll see Smith pushing that average much higher",none,none,none,49,48,40,69,18,109,1,-12,134,28, 1 / 21, 4 / 21, 14 / 21, 6 / 21, 0 / 21,0,0,0,0,0,0,none,14,0,14,27.75,31.14285714,36,none,81.76190476,0,82.54545455,-1,80.9,1,72,10,none,none,84.45,-2,93.54545455,81.76190476,84.42857143,81.5625,88.63636364,87.5,79.91304348,149,154,130,136,78,79,94,107.8955646,95.43859649,98.007034,107.3957514,104.458042,92.81437126,95.64676617,-11.78354978,-2.666666667,2.866071429,-7.073863636,1.136363636,7.586956522,3.217391304,20.23809524,74.48075516,27.65384919,3.19047619,2.952380952,4.619047619,25.11622807,80.7235179,28.70226389,3.141985646,2.327352472,7.156419458,Intercepts
CD_I1006059,Keidean Coleman,4,Snr,95,105,479000,87,Low,D22,D15,,3,19,0,"Coleman was a popular mid-priced starting option in 2022 after scoring 87, 90 and 77 in his last 3 games of 2021 following a move to defence. However, it was short lived as Coleman had a delayed start due to a preseason hamstring injury, but returned to produce a breakout season, averaging 87 and looking great as a defender. He showed enough to suggest he could one day be a top 6 SuperCoach defender, averaging 97 post bye as his kick-in numbers increased and he gained more confidence. However, I just doubt that he can produce top 6 numbers while Rich is still around taking the majority of the kick-ins.",Breakout 2022 with 97 post bye but unlikley to be a top 6 while Rich is still around,none,none,none,36,34,21,25,34,114,-2,0,119,47, 0 / 18, 5 / 18, 10 / 18, 3 / 18, 0 / 18,0,0,none,0,0,0,none,60,0,none,33.4,11.3,6.666666667,none,87,0,78.5,9,96.71428571,-10,88.25,-1,89.33333333,-2,89.76470588,-3,87.38888889,87.38888889,52.75,53,none,none,none,190,111,417,371,none,none,none,117.2131148,104.7690015,66.89059501,69.37340153,none,none,none,0,34.63888889,-0.25,none,none,none,none,18.11111111,80.96436321,27.12021886,2,2.444444444,5.055555556,25.11622807,80.7235179,28.70226389,3.141985646,2.327352472,7.156419458,Intercepts
CD_I296355,Luke McDonald,10,Snr,90,94,487300,89,Fair,D36,D49,,3,29,0,"The former top 10 pick has had a mixed Fantasy career. After a career high season in 2020 which included a 10 week stretch averaging 118, he moved to a wing in 2021 and Hall and Ziebell took his role as the easy accumulator. McDonald's average dropped to just 68 points in this wing role. He returned to defence last season and improved his average, but was far from the role that saw him be a top defender in 2020. It's unclear what role he'll play under Clarko, but I think one things is for sure that they won't be doing the slow 'chip-mark' game that the Roos have played for the last 3 seasons. One to watch, but you'd need certainty on role before selecting him.","Has it in him to go big as we saw in the back end of 2020, just don't know what role Clarko will have for him",none,none,none,31,32,53,30,15,116,17,-6,140,24, 3 / 22, 7 / 22, 10 / 22, 4 / 22, 0 / 22,0,0,0,0,0,0,none,25,17,64.66666667,39,15.1,8.5,none,88.5,1,89.23076923,0,87.44444444,2,85.4,4,none,none,91.57142857,-3,95.47058824,88.5,68.36363636,95.47058824,60.23076923,66.72727273,83.86363636,136,106,254,72,295,201,77,104.9805951,88.04739825,89.48626045,99.6927555,67.08613967,84.45783133,105.0245098,-6.970588235,20.13636364,-27.10695187,35.239819,-6.496503497,-17.13636364,20.13030303,20.27272727,80.14678545,31.36776843,3.363636364,2.454545455,5.363636364,25.11622807,80.7235179,28.70226389,3.141985646,2.327352472,7.156419458,Intercepts
CD_I297907,Nic Newman,9,Snr,87,94,441600,80,Low,D40,D50,,3,0,0,"Newman has had flashes of SuperCoach brilliance throughout his career, however he's never put together a full season. Hes behind Docherty and Saad for distribution duties, which means hes too inconsistent to rely on in SuperCoach.",Too inconsistent to rely on in SuperCoach,none,none,none,52,53,37,91,15,108,-1,-17,109,25, 0 / 19, 3 / 19, 12 / 19, 5 / 19, 1 / 19,0,0,none,0,0,0,0,38,8,none,21,13.5,12.6,8,80.21052632,0,77.18181818,3,84.375,-4,66.5,14,none,none,83.27777778,-3,96.65,80.21052632,87.64285714,23.5,96.65,71.90909091,80.1,131,165,100,446,50,167,93,115.1966627,95.90909091,106.7078553,80.55555556,111.2634088,101.2278308,110.0917431,-16.43947368,-7.432330827,64.14285714,-73.15,24.74090909,-8.190909091,none,19.57894737,80.67019516,28.09186428,2.578947368,2.315789474,5.210526316,25.11622807,80.7235179,28.70226389,3.141985646,2.327352472,7.156419458,Intercepts
CD_I294429,Luke Dunstan,10,Snr,73,73,322100,59,Unders,M116,M187,,3,14,0,"Dunstan has shown he's a genuine Fantasy scorer when given the opportunity, however it's the opportunity that he has struggled with his whole career. He played 4 games in his first season at the Dees and will likely remain a depth player behind their star mids.",Will likely remain a depth player behind the Dee star mids,none,none,none,110,96,105,none,41,86,-10,-34,73,50, 0 / 4, 0 / 4, 4 / 4, 2 / 4, 1 / 4,46,32,none,none,58,56.5,32,0,0,none,none,0,0,0,65,-6,65,-6,none,none,none,none,none,none,70,-11,93.05555556,65,92.16666667,92,93.05555556,80.5,88.25,154,301,75,87,68,113,59,125.0746714,84.31372549,114.4153226,154.3209877,115.6660693,114.2857143,121.6666667,-28.05555556,-27.16666667,0.166666667,-1.055555556,12.55555556,-7.75,16.25,15.75,80.3030303,43.19852941,2.25,2.75,3.25,28.83718956,70.44127769,46.78371283,3.968325922,5.324824605,6.468673419,Clearances
CD_I297452,Nick Hind,5,Snr,90,92,491300,89,Fair,D37,D52,,3,0,0,"Hind backed up his breakout 2021 with a 89 average in 2022. He's a good player and I'd be surprised if his role changes much under the new coach. However, there is no shortage of distributors in defence at the Dons so I doubt we'll suddenly see an increase in average anytime soon.",No shortage of distributors in defence at the Dons so I doubt we'll suddenly see an increase in average anytime soon,none,none,none,30,31,31,39,19,117,5,-4,128,38, 1 / 21, 7 / 21, 11 / 21, 3 / 21, 1 / 21,0,0,0,0,0,0,0,25,0,25,20.42857143,15.36363636,3,0,89.23809524,0,83.8,5,94.18181818,-5,83.6,5,none,none,91.8,-3,93,89.23809524,93,61.6,57.27272727,none,none,157,104,67,290,314,none,none,114.338011,98.90176937,100.9777295,73.35841313,64.79560708,none,none,-3.761904762,-3.761904762,31.4,4.327272727,none,none,none,20.42857143,80.00637145,26.78630712,2.571428571,1.761904762,4.80952381,25.11622807,80.7235179,28.70226389,3.141985646,2.327352472,7.156419458,Intercepts
CD_I280506,Taylor Walker,15,Snr,84,84,499200,91,Overs,F22,F71,,3,11,16,"Walker's late-career resurgence has been great to watch. However, outside of averaging 118 after 6 rounds in 2021, he's still a key forward and key forwards aren't what you want in SuperCoach.",Scores above average for a key forward however key forwards aren't what you want in SuperCoach,none,none,none,11,11,36,33,4,118,19,-7,150,40, 2 / 18, 8 / 18, 8 / 18, 6 / 18, 0 / 18,0,0,0,0,0,0,none,0,0,0,0,0,0,none,90.66666667,0,100,-9,83.2,8,79,12,none,none,93.64705882,-3,98.10526316,90.66666667,86.23529412,55.5,67.31818182,63.28571429,83.7826087,114,96,114,359,228,230,78,104.2145594,88.56960409,87.56830601,55.7628524,72.4137931,77.7638191,89.12797282,-7.438596491,4.431372549,30.73529412,-11.81818182,4.032467532,-20.49689441,1.434782609,14.16666667,64.16426613,52.08221472,3.611111111,2,2.611111111,20.35798074,70.28924512,43.39027832,3.038980488,4.25614499,1.318991781,Goals
CD_I298419,Brandan Parfitt,7,Snr,73,78,408100,74,Full,M117,M170,,3,14,5,"Parfitt hasn't been a factor in SuperCoach even when he had forward status. He's now only available in the midfield, and considering he was in and out of the side at the end of 2022, he's not worth considering in Fantasy. ",Mid-only and behind in the pecking order now at Geelong,none,none,none,77,84,38,73,61,101,-18,-11,108,15, 0 / 17, 1 / 17, 13 / 17, 8 / 17, 2 / 17,66,7,none,66,47.30769231,50.125,14.5,0,0,none,0,0,0,0,74.125,0,74.33333333,0,73.5,1,73.5,1,27,47,74.875,-1,84.66666667,71.35294118,78.81818182,84.66666667,78.05,78.52631579,53.73333333,213,233,168,117,143,129,243,118.6915888,114.8316652,105.8457711,119.8403427,100.2086231,93.03482587,74.45355191,-13.31372549,-7.465240642,-5.848484848,6.616666667,-0.476315789,24.79298246,none,20.47058824,66.1711632,45.0625912,4.529411765,4.705882353,4.352941176,28.83718956,70.44127769,46.78371283,3.968325922,5.324824605,6.468673419,Clearances
CD_I291570,Nat Fyfe,14,Snr,0,0,313600,57,Overs,M235/F261,M236/F261,,0,0,0,0,0,none,none,none,113,88,84,162,1,84,-7,-67,96,32, 0 / 7, 0 / 7, 6 / 7, 4 / 7, 1 / 7,37,17,none,none,27.5,29.25,17,0,0,none,none,0,0,0,63.28571429,-6,83,-26,60,-3,37,20,none,none,68.5,-12,124.3,63.28571429,100.4,113.2,120,113.9,108.8,12,323,42,15,4,7,13,144.5626478,77.05882353,103.852459,115.100087,121.4699074,124.6642247,109.8083427,-61.01428571,-37.11428571,-12.8,-6.8,6.1,5.1,3.7,15.14285714,68.36940837,51.7125335,3,2.857142857,0.857142857,20.35798074,70.28924512,43.39027832,3.038980488,4.25614499,1.318991781,Goals
CD_I291848,Robbie Fox,7,Snr,69,75,425000,77,Full,D88,D110,,3,10,14,"Fox had a career best average of 75 in 2021, but remained on the fringe in a strong Swans team. I think it will be much the same in 2023.",Never played more than 15 games in a season and always seems to be on the fringe,none,none,none,60,57,62,70,57,105,6,-1,135,36, 1 / 13, 2 / 13, 8 / 13, 5 / 13, 0 / 13,0,0,0,0,0,0,none,0,0,0,0,0,0,none,77.2,0,36,41,81.77777778,-5,71.8,5,80,-3,81.33333333,-4,77.84615385,77.84615385,56.2,71.78571429,55,52.2,60.33333333,290,183,381,209,332,294,211,87.694974,84.2287695,64.56542502,59.97983871,69.44779359,61.91117093,64.1025641,0,21.64615385,-15.58571429,16.78571429,2.8,-8.133333333,none,18.53846154,81.57746274,27.83054628,2.307692308,2.230769231,5.307692308,25.11622807,80.7235179,28.70226389,3.141985646,2.327352472,7.156419458,Intercepts
CD_I993979,Sam Powell-Pepper,7,Snr,75,80,408400,74,Fair,F50,F77,,3,20,0,"SPP had a career best season, playing all 22 games as a strong bodied forward. After bursting onto the scene 6 years ago, I had him earmarked to be a midfielder for years to come. However, he's found it hard for midfield minutes and bottomed out last season at just 3%. He's clearly not in calculations anymore and been surpassed by Rozee and Butters, so I think that forward role will be him going forward. In that role, it's hard to see him ever averaging much more than 75.",Settled in a forward role last season which produced a career best season but not good enough for SuperCoach,none,none,none,49,49,24,38,37,101,-6,-4,131,32, 1 / 22, 2 / 22, 19 / 22, 9 / 22, 0 / 22,0,10,0,0,3.842105263,4.666666667,none,0,0,0,0,0,0,none,74.18181818,0,75,-1,73.36363636,1,78.2,-4,none,none,76.19047619,-2,78.4,74.18181818,63.25,75.3,74.3,78.4,64.8,284,212,305,184,169,131,179,105.0938338,94.14715719,90.9178744,97.51962884,92.96727604,100.536193,105.4814815,-4.218181818,10.93181818,-12.05,1,-4.1,13.6,none,16.59090909,66.73655053,36.94916916,3.090909091,3.363636364,1.090909091,20.35798074,70.28924512,43.39027832,3.038980488,4.25614499,1.318991781,Goals
CD_I261510,Tom Hawkins,17,Snr,85,88,519500,94,Overs,F18,F55,,3,11,18,"The ever-green 34-year-old full forward is playing as well as ever in real life and continues to put up to 10 forward numbers in SuperCoach. However, he crosses two of my boxes in age and role, so I'd much rather own a young player with midfield potential in my SuperCoach forward line.",Ever-green but hard to see him maintaining his top 6 numbers,none,none,none,6,6,60,5,2,122,34,-13,148,33, 4 / 25, 11 / 25, 10 / 25, 3 / 25, 0 / 25,0,0,0,0,0,0,none,0,0,0,0,0,0,none,94.36363636,0,90.5,4,99,-5,110,-16,99.66666667,-6,97.58333333,-4,106.5238095,95,93.75,106.5238095,85.125,101,83.63636364,65,68,65,26,96,31,80,111.4598904,81.48774303,78.96709704,94.66865969,75.73714491,94.87459106,80.98818475,-11.52380952,1.25,-12.77380952,21.39880952,-15.875,17.36363636,0.33201581,13.12,61.67030391,49.74920635,2.56,1.56,2.68,20.35798074,70.28924512,43.39027832,3.038980488,4.25614499,1.318991781,Goals
