CD_I992128,Ryan Burton,8,Snr,79,84,704000,80,Full,D41,D61,120,3,29,0,"After averaging 84 in his second season, Burton looked to be a star Fantasy defender of the future. He hasn't matched that average since in 5 seasons. Unfortunately, he hasn't come on and you can't take the risk on him turning it around this year.",Hasn't come on as I though he was going to after his 84 average in year 2,none,none,none,30,31,32,42,22,96,-3,-4,113,52, 0 / 22, 4 / 22, 15 / 22, 8 / 22, 0 / 22,0,0,none,0,0,0,none,70,50,none,50,41,39.625,none,79.54545455,0,76.36363636,4,82.72727273,-3,75,5,none,none,80.85714286,-1,84.4,79.54545455,73.83333333,61.40625,72.3125,61.9,84.4,175,120,151,259,147,210,76,101.9922426,98.36987071,96.40914037,96.13502935,101.9922426,78.25537295,98.48308051,-4.854545455,5.712121212,12.42708333,-10.90625,10.4125,-22.5,37.6,15.81818182,4.5,5.227272727,0,0.181818182,1.954545455,18.37184343,7.169823232,7.289141414,0,0.150252525,2.440656566
CD_I270896,Trent Cotchin,16,Snr,75,75,701000,79,Full,M108,M176,121,3,18,20,"Cotchin plays a perfect team game for the Tigers and as a result, hasn't been a factor in AFL Fantasy for a number of years now. Certainly not an option this year, especially considering he’ll likely lose midfield time to Hopper and Taranto.",Hasn't had a Fantasy game for 5 years now,none,none,none,63,64,62,23,4,96,-7,-32,121,39, 1 / 19, 2 / 19, 14 / 19, 5 / 19, 0 / 19,76,56,76,82,72.78571429,70.4,none,0,0,0,0,0,0,none,79.16666667,0,72.3,7,87.75,-9,99,-20,65,14,80.61111111,-2,110.7,78.42105263,75.82352941,81.17647059,70.14285714,80.5,95.6,34,123,142,117,163,86,35,131.942789,102.0547945,104.796748,111.7408907,98.79275654,104.9543677,119.7994987,-32.27894737,2.59752322,-5.352941176,11.03361345,-10.35714286,-15.1,-1.3,11.57894737,11.10526316,3.105263158,0.052631579,0.263157895,2.842105263,14.66796966,14.71370328,4.255247469,0,0.358074365,6.019313111
CD_I994185,Jordan De Goey,9,Snr,84,88,700000,79,Fair,M75,M127,122,3,13,5,"De Goey burst into Fantasy relevance in 2021 when he was shifted into the midfield and averaged 110 for the second half of the season. McRae kept him in there for the full season, attending 77% of the CBAs, however never met those scoring heights, averaging 79 for the regular season. It was a mixture of both McRae's low possession game style and the focus for De Goey to get his possessions in a dangerous position forward of centre. We might see him spend a bit more time forward as the Pies' midfield depth should be deeper with Tom Mitchell and hopefully Adams rotating in there, so while I think he should outperform 79 which he's priced at, I doubt we'll see the 100+ De Goey again under McRae.",First full season as a midfeilder however McRae's lower possession game plan and focus to get the ball forward of centre means he might not be that 100+ player again,none,none,none,64,58,81,62,53,96,-1,-5,124,37, 1 / 19, 3 / 19, 13 / 19, 5 / 19, 0 / 19,91,57,91,82.33333333,75.15384615,73.4,none,0,0,0,0,0,0,none,79.0625,0,82.08333333,-3,70,9,81,-2,91.33333333,-12,83.44444444,-4,84.3,81,84.3,71.5,79.94117647,78.9,79.5,177,111,90,176,106,99,88,102.884397,93.84146341,101.0791367,82.18390805,102.884397,97.16748768,97.54601227,-3.3,-3.3,12.8,-8.441176471,1.041176471,-0.6,4,11.94736842,8.842105263,3.210526316,0,0.947368421,3.473684211,14.66796966,14.71370328,4.255247469,0,0.358074365,6.019313111
CD_I295067,James Aish,10,Snr,81,80,698000,79,Fair,M87,M157,123,3,10,5,"Aish has become a reliable role player for Freo, playing a range of positions which included being a tagger in 2022 but mainly as a wingman. He's a mid 70s type player, which certainly doesn't make him relevant in Fantasy, particularly as a mid-only.",Versatile role player not one for Fantasy,none,none,none,65,66,74,55,66,96,-2,2,123,41, 1 / 23, 4 / 23, 18 / 23, 8 / 23, 0 / 23,0,23,0,21.75,14,24.25,none,0,0,0,0,0.555555556,0,none,78.76190476,0,77.33333333,2,80.66666667,-2,84,-5,57.5,22,78.54545455,0,76.953125,76.91304348,69.45454545,76.953125,65.28571429,68.7,61.9,239,134,197,137,211,161,192,95.82881907,95.82881907,83.81788261,92.71460843,83.59246387,85.34161491,85.14442916,-0.040081522,7.458498024,-7.498579545,11.66741071,-3.414285714,6.8,-1.6,11.34782609,9.47826087,4.47826087,0,0.217391304,2.434782609,14.66796966,14.71370328,4.255247469,0,0.358074365,6.019313111
CD_I294199,Sam Menegola,12,Snr,75,70,698000,79,Full,M109,M192,124,3,7,14,"Once a relevant Fantasy forward fell out of favour last season, playing just the 7 games at an average of 68. Now 31, it's likely he'll struggle for games again, especially considering Geelong's off season recruiting.",Will likely struggle for games again,none,none,none,65,88,70,54,17,96,-4,-22,92,4, 0 / 7, 0 / 7, 6 / 7, 1 / 7, 1 / 7,3,0,none,none,9,0,0,0,0,none,none,0,0,0,67.57142857,11,none,none,67.57142857,11,84.5,-6,none,none,78.16666667,1,101.4,67.57142857,86.91304348,100.8928571,76.33333333,97.5,101.4,67,219,73,30,127,30,22,129.6675192,98.13278008,106.6702241,120.0424929,99.26311227,121.7228464,129.6675192,-33.82857143,-19.34161491,-13.97981366,24.55952381,-21.16666667,-3.9,12,12.42857143,5.428571429,4,0,0.714285714,1.142857143,14.66796966,14.71370328,4.255247469,0,0.358074365,6.019313111
CD_I994386,Tom Atkins,5,Snr,86,90,697000,79,Low,D23/M66,D33/M104,125,3,12,10,"Moved into the midfield with great team impact in 2022, highlighted by his strong tackle pressure. He had a small bump in output (66 in 2021 to 82 post bye in 2022 when CBAs went to 59%) but 82 is still not enough to be a relevant defender. Should improve again with Selwood out, but I think he's one of those who is too team orientated to make a impact in Fantasy.",Pressure midfielder who is too team orientated to make an impact in Fantasy,none,none,none,31,33,24,43,33,96,-8,1,108,56, 0 / 25, 1 / 25, 20 / 25, 5 / 25, 0 / 25,60,6,none,60,31.45,40.6,none,0,0,none,0,1,0,none,78.72727273,0,76.16666667,3,81.8,-3,74.2,5,75.66666667,3,79.29166667,0,78.36,78.36,65.59090909,49.375,53.73913043,none,none,225,124,234,363,318,none,none,103.595981,103.595981,79.15523862,66.20111732,67.09005048,none,none,0,12.76909091,16.21590909,-4.364130435,none,none,none,9.52,8.56,2.6,0,0.16,6.28,18.37184343,7.169823232,7.289141414,0,0.150252525,2.440656566
CD_I1000981,Daniel Rioli,8,Snr,79,85,694000,78,Fair,D42,D52,126,3,0,0,"Rioli was a revelation in 2022, switching to half back and becoming a star running defender of the comp. The move improved his Fantasy output by 22 points per game to finish with 78 for the season. There's no question he'll remain in the role, even if Short moves back again, but he'll unlikely push that average to the 90 mark needed to be a relevant defender this season.",Starred down back and will remain in that role but unlikely push that average to the 90 mark needed to be a relevant defender,none,none,none,32,34,38,40,34,95,-3,0,108,56, 0 / 23, 3 / 23, 18 / 23, 7 / 23, 0 / 23,0,0,none,0,0,0,none,30,12,none,23.33333333,14.5,20.14285714,none,78.36363636,0,76.81818182,1,79.90909091,-2,75.6,2,77,1,79.31818182,-1,78.30434783,78.30434783,55.88888889,64.375,55,65.8,53.8,226,125,341,230,303,181,238,95.79787234,95.79787234,75.41229385,79.47530864,66.82867558,81.13440197,66.17466175,0,22.41545894,-8.486111111,9.375,-10.8,12,4.6,11.56521739,8.913043478,4.782608696,0,0.434782609,2.347826087,18.37184343,7.169823232,7.289141414,0,0.150252525,2.440656566
CD_I991930,Darcy Byrne-Jones,10,Snr,76,78,694000,78,Full,D53,D79,127,3,0,0,"Byrne-Jones has been a 70s/80s guy for the past 5 seasons. That's about him I think, so he's not worth considering in Fantasy.",A 70s/80s defender,none,none,none,32,32,33,61,20,95,-5,-8,107,50, 0 / 21, 1 / 21, 15 / 21, 7 / 21, 0 / 21,0,0,none,0,0,0,none,0,0,none,0,2.133333333,0,none,78.42857143,0,78.72727273,-1,78.1,0,68.2,10,none,none,79.85,-2,86.40909091,78.42857143,76.375,77.10526316,86.40909091,71.6,66.7,154,122,139,136,80,142,167,102.8679654,98.15256257,95.17133956,92.19634991,102.8679654,85.74850299,79.4047619,-7.980519481,2.053571429,-0.730263158,-9.303827751,14.80909091,4.9,7.7,13,8.714285714,5.333333333,0,0.047619048,1.857142857,18.37184343,7.169823232,7.289141414,0,0.150252525,2.440656566
CD_I1005521,Oscar McInerney,7,Snr,82,82,694000,78,Low,R11,R21,128,3,0,0,"The Big O has become a solid ruck, averaging mid-70s for the past 3 seasons. While solid, he's had the number 1 mantle at the Lions for long enough to know that he's never going to challenge the top few in Fantasy.",Averaged mid-70s since being the number 1 ruck,none,none,none,11,10,13,11,10,95,-4,1,116,9, 0 / 22, 3 / 22, 15 / 22, 9 / 22, 1 / 22,81,3,none,76.33333333,66.73333333,62.33333333,3,0,0,none,0,0,0,0,78.4,0,73.83333333,4,85.25,-7,79.2,-1,50,28,79,-1,77.47826087,75.81818182,77.47826087,74.53947368,55.52380952,53.4,zero,233,141,134,153,294,270,none,97.37302977,97.37302977,93.83886256,93.85354539,74.62877624,67.00125471,zero,-1.660079051,-1.660079051,2.938787185,19.01566416,2.123809524,none,none,6,5.818181818,2.045454545,26.18181818,0.409090909,2.909090909,11.64772727,6.860795455,5.491477273,25.38920455,0.639204545,2.190340909
CD_I296351,Jack Billings,10,Snr,88,90,693000,78,Low,M63,M105,129,3,5,0,"The former number three pick looked set to fulfill his potential in 2019, pushing up the ground to average 99 points per game, including 106 in the last half. Unfortunately, he hasn't gone on with it, dropping his average in every season since to finish on 75 last year. At 27, he should be in his prime and may appear underpriced to what he could produce. However, Billings needs two things to be relevant in Fantasy; forward status and CBAs. Unfortunately, he's available mid-only and attended no centre bounces last season.",Reduced his averaged every year since 2019,none,none,none,67,69,50,113,20,95,-12,-21,98,0, 0 / 8, 0 / 8, 2 / 8, 2 / 8, 1 / 8,0,0,none,none,0,0,0,0,0,none,none,0,0,0,75.375,3,64.5,14,79,-1,0,78,none,none,86.14285714,-8,98.5,75.375,83.27777778,91.97368421,98.5,85.2,94.6,82,145,99,62,35,71,37,111.4252061,108.8447653,98.7483531,106.8807339,111.1738149,98.72537659,111.4252061,-23.125,-7.902777778,-8.695906433,-6.526315789,13.3,-9.4,15.2,11.5,5.5,5.75,0,0.625,2.375,14.66796966,14.71370328,4.255247469,0,0.358074365,6.019313111
CD_I1005054,Josh Daicos,7,Snr,75,95,691000,78,Full,M110,M80,130,3,7,0,"After finishing 2020 averaging 94 in the second half of the season playing inside-mid, Daicos has been used predominantly as a wingman since, meaning he's yet to recapture that scoring ability. He saw some CBAs in the back half of 2022, averaging 22% post bye, and naturally improved his average to 86 from 72. The Pies were light on for inside mids, but with Tom Mitchell's arrival and a healthy Taylor Adams, I expect Daicos to move back to his wing role, which means he'll be capped with his scoring output in 2023.",Scoring is limited when on the wing which is where he'll likely play in 2023,none,none,none,68,63,88,48,50,95,1,-7,125,33, 2 / 25, 5 / 25, 18 / 25, 11 / 25, 0 / 25,36,0,18,12.4,9.888888889,10,none,0,0,0,0,0,0,none,78,0,72.23076923,6,86.33333333,-8,87,-9,83.33333333,-5,80.54166667,-3,84.86111111,78.64,71.35294118,84.86111111,63.2,68.3,59.5,169,121,173,100,229,165,210,100.2954695,91.06067624,90.11887073,100.2954695,88.26815642,92.54742547,83.10055866,-6.221111111,7.287058824,-13.50816993,21.66111111,-5.1,8.8,none,12.56,8.52,4.04,0,0.6,2.6,14.66796966,14.71370328,4.255247469,0,0.358074365,6.019313111
CD_I291748,Brodie Smith,13,Snr,78,80,688000,78,Full,D46,D66,131,3,29,0,"Smith has been a consistent defender for a number of years now without taking that next step and being a Fantasy relevent one. His kick-ins are low for someone with such a nice kick (only 31%) as he's made way for Dawson to be the main man back there. While Dawson is playing in defence, I doubt we'll see Smith pushing that average much higher.","While Dawson is playing in defence, I doubt we'll see Smith pushing that average much higher",none,none,none,34,37,40,53,19,95,-3,-9,141,33, 1 / 21, 4 / 21, 14 / 21, 9 / 21, 0 / 21,0,0,0,0,0,0,none,14,0,14,24.25,31.14285714,28.66666667,none,77.71428571,0,79.18181818,-1,76.1,2,72.4,6,none,none,79.95,-2,86.90909091,77.71428571,79.61904762,85.3125,86.90909091,77.5,76.9,149,129,123,99,77,107,104,107.3957514,95.43859649,98.007034,107.3957514,104.458042,92.81437126,95.64676617,-9.194805195,-1.904761905,-5.693452381,-1.596590909,9.409090909,0.6,-0.5,14.61904762,5.619047619,4.095238095,0,0.142857143,2.952380952,18.37184343,7.169823232,7.289141414,0,0.150252525,2.440656566
CD_I1006059,Keidean Coleman,4,Snr,83,97,688000,78,Low,D35,D18,132,3,0,0,"Coleman had a delayed start to 2022 after a preseason hamstring injury, but returned to produce a breakout season, averaging 78 and looking great as a defender. He averaged 109 in the role at reserve level in 2021, so he can obviously find it. He showed enough to suggest he could one day be a top 6 Fantasy defender, I just doubt that it will be this season while Rich is still around taking the majority of the kick-ins. He did increase his kick-ins as the season went on which resulted in a bump in average.",Breakout 2022 but unlikley to be a top 6 while Rich is still around,none,none,none,34,35,21,58,35,95,-10,0,105,54, 0 / 18, 2 / 18, 11 / 18, 7 / 18, 0 / 18,0,0,none,0,0,0,none,23,17,none,41.5,11,11.14285714,none,77.73333333,0,73.5,5,82.57142857,-5,70.25,8,80,-2,79.52941176,-2,78.11111111,78.11111111,43.5625,54.25,none,none,none,227,127,458,323,none,none,none,104.7690015,104.7690015,66.89059501,69.37340153,none,none,none,0,34.54861111,-10.6875,none,none,none,none,13,5.111111111,5.944444444,0,0.222222222,2.444444444,18.37184343,7.169823232,7.289141414,0,0.150252525,2.440656566
CD_I296355,Luke McDonald,10,Snr,84,90,688000,78,Fair,D33,D34,133,4,29,0,"The former top 10 pick has had a mixed Fantasy career. After a career high season in 2020 which included a 7 week stretch averaging 121 with 3 150s, he moved to a wing in 2021 and Hall and Ziebell took his role as the easy accumulator. McDonald's average dropped to just 68 points in this wing role. He returned to defence last season and improved his average, but was far from the role that saw him be a top defender in 2020. It's unclear what role he'll play under Clarko, but I think one things is for sure that they won't be doing the slow 'chip-mark' game that the Roos have played for the last 3 seasons. One to watch, but you'd need certainty on role before selecting him.","Has it in him to go big as we saw in the back end of 2020, just don't know what role Clarko will have for him",none,none,none,34,38,53,55,11,95,3,-13,109,34, 0 / 22, 5 / 22, 16 / 22, 9 / 22, 0 / 22,0,0,none,0,0,0,none,25,17,none,45.4,22.25,12.66666667,none,77.68181818,0,79.84615385,-2,74.55555556,3,71.8,6,none,none,79.76190476,-2,90.66176471,77.68181818,68.09090909,90.66176471,58.23076923,70.1,85.7,125,130,209,67,267,152,66,105.0245098,88.04739825,89.48626045,99.6927555,67.08613967,84.45783133,105.0245098,-12.97994652,9.590909091,-22.57085561,32.43099548,-11.86923077,-15.6,29.1,13.86363636,6.409090909,5.409090909,0,0.045454545,2.454545455,18.37184343,7.169823232,7.289141414,0,0.150252525,2.440656566
CD_I297907,Nic Newman,9,Snr,83,84,688000,78,Low,D36,D62,134,3,0,0,"Newman has had flashes of Fantasy brilliance throughout his career, however he's never put together a full season. He’s behind Docherty and Saad for distribution duties, which means he’s too inconsistent to rely on in Fantasy.",Too inconsistent to rely on in Fantasy,none,none,none,34,36,37,89,9,95,-3,-15,117,19, 0 / 19, 2 / 19, 13 / 19, 5 / 19, 1 / 19,0,0,none,0,0,0,0,25,8,none,31.5,13.46153846,14.2,8,77.73684211,0,76.09090909,2,80,-2,57.5,21,none,none,81,-3,93.35,77.73684211,86.35714286,36.25,93.35,74.2,84,110,128,75,425,54,125,77,111.2634088,95.90909091,106.7078553,80.55555556,111.2634088,101.2278308,110.0917431,-15.61315789,-8.620300752,50.10714286,-57.1,19.15,-9.8,none,13.26315789,6.315789474,6.210526316,0,0,2.315789474,18.37184343,7.169823232,7.289141414,0,0.150252525,2.440656566
CD_I294429,Luke Dunstan,10,Snr,75,75,687000,78,Full,M111,M177,135,3,14,0,"Dunstan has shown he's a genuine Fantasy scorer when given the opportunity, however it's the opportunity that he has struggled with his whole career. He played 4 games in his first season at the Dees and will likely remain a depth player behind their star mids.",Will likely remain a depth player behind the Dee star mids,none,none,none,69,121,105,none,1,95,7,-47,65,37, 0 / 4, 0 / 4, 4 / 4, 4 / 4, 1 / 4,81,32,none,none,58,58,32,0,0,none,none,0,0,0,53.75,24,53.75,24,none,none,none,none,none,none,59.33333333,19,125,53.75,94.58333333,125,86.05555556,82.4,87.6,2,391,45,1,81,76,61,154.3209877,84.31372549,114.4153226,154.3209877,115.6660693,114.2857143,121.6666667,-71.25,-40.83333333,-30.41666667,38.94444444,3.655555556,-5.2,18.8,5.5,10.25,2.5,0,0,2.75,14.66796966,14.71370328,4.255247469,0,0.358074365,6.019313111
CD_I297452,Nick Hind,5,Snr,0,0,684000,77,Overs,D238,D238,136,3,0,0,"Hind backed up his breakout 2021 with a 77 average in 2022. He's a good player and I'd be surprised if his role changes much under the new coach. However, there is no shortage of distributors in defence at the Dons so I doubt we'll suddenly see an increase in average anytime soon.",No shortage of distributors in defence at the Dons so I doubt we'll suddenly see an increase in average anytime soon,none,none,none,38,39,31,48,22,94,-6,-8,106,45, 0 / 21, 2 / 21, 15 / 21, 7 / 21, 1 / 21,0,0,none,0,0,0,0,8,0,none,16.5,17.73333333,11.28571429,0,77.19047619,0,71.7,5,82.18181818,-5,73.2,4,none,none,78.8,-2,84.5,77.19047619,84.5,53.625,48.27272727,none,none,173,131,87,331,358,none,none,100.9777295,98.90176937,100.9777295,73.35841313,64.79560708,none,none,-7.30952381,-7.30952381,30.875,5.352272727,none,none,none,16.0952381,4.333333333,4.428571429,0,0.095238095,1.761904762,18.37184343,7.169823232,7.289141414,0,0.150252525,2.440656566
CD_I280506,Taylor Walker,15,Snr,70,70,683000,77,Overs,F57,F113,137,3,11,0,"Walker's late-career resurgence has been great to watch. However, outside of averaging 115 after 4 rounds in 2021, he's still a key forward and key forwards aren't what you want in Fantasy.",Scores above average for a key forward however key forwards aren't what you want in Fantasy,none,none,none,18,19,36,61,10,94,2,-8,105,27, 0 / 18, 2 / 18, 10 / 18, 8 / 18, 0 / 18,0,0,none,0,0,0,none,0,0,none,0,0,0,none,77.05555556,0,80.625,-4,74.2,3,65.2,12,none,none,80,-3,84.5,77.05555556,75.41176471,48.03571429,63,61.9,78.7,173,133,145,374,234,210,94,89.70276008,88.56960409,87.56830601,55.7628524,72.4137931,77.7638191,89.12797282,-7.444444444,1.64379085,27.37605042,-14.96428571,1.1,-16.8,2.1,9.333333333,4.833333333,5.222222222,1.944444444,2.611111111,2,11.90174321,10.68112389,4.63541949,0.014492754,0.998272084,4.799175293
CD_I298419,Brandan Parfitt,7,Snr,75,80,681000,77,Full,M112,M158,138,3,14,5,"Parfitt has been borderline relevant in Fantasy when he had forward status. He's now only available in the midfield, and considering he was in and out of the side at the end of 2022, he's not worth considering in Fantasy. ",Mid-only and behind in the pecking order now at Geelong,none,none,none,70,72,38,69,49,94,-16,-8,104,23, 0 / 17, 1 / 17, 13 / 17, 6 / 17, 2 / 17,40,7,none,40,49.76923077,44,14.5,0,0,none,0,0,0,0,76.9375,0,77.08333333,0,76.5,1,76.5,1,31,46,77.4375,0,85.48611111,74.23529412,74,85.48611111,72.05,74.8,54.5,164,152,149,98,150,122,233,119.8403427,114.8316652,105.8457711,119.8403427,100.2086231,93.03482587,74.45355191,-11.25081699,0.235294118,-11.48611111,13.43611111,-2.75,20.3,none,9.882352941,10.58823529,1.882352941,0,0.294117647,4.705882353,14.66796966,14.71370328,4.255247469,0,0.358074365,6.019313111
CD_I291570,Nat Fyfe,14,Snr,82,84,681000,77,Fair,M84/F20,M150/F59,139,3,18,15,"Fyfe has been impacted by injuries in 5 of his last 7 seasons, however hit rock bottom in 2022. He's never been a natural Fantasy player as he's very much in the Dustin Martin mould of too good in real life to worry about tackling or picking up cheap marks. Despite winning two Brownlows and being one of the premier midfielders in the AFL, Fyfe's best Fantasy season average is just 105. He finished 2022 with an average of 56, which is 49 points off his best ever 105. The form drop was largely injury related, but also came about from the emergence of Brayshaw, Serong and Brodie, meaning Fyfe spent time forward this season - just 29% CBAs. There was a lot of debate as to where Fyfe should play and I'm not sure Freo really knew either. Regardless, he should certainly bounce back and score much better than he did in 2022. Due to playing 7 games, he's priced at a discount to his 2021 average of 84. That makes him less appealing to select in the forward line this season.",Injury impacted 2022 but role uncertainty takes the gloss off any great bounce back,none,none,none,19,101,84,156,2,94,14,-28,89,30, 0 / 7, 0 / 7, 7 / 7, 6 / 7, 1 / 7,37,17,none,none,28.85714286,27.5,17,0,0,none,none,0,0,0,56.14285714,21,67,10,54.33333333,23,39.5,38,none,none,60.5,17,104.95,56.14285714,84.46666667,94.46428571,104.95,102.1,97.4,54,346,88,53,17,18,31,124.6642247,77.05882353,103.852459,115.100087,121.4699074,124.6642247,109.8083427,-48.80714286,-28.32380952,-9.997619048,-10.48571429,2.85,4.7,-1.2,5.285714286,9.857142857,2.857142857,0,0.857142857,2.857142857,11.90174321,10.68112389,4.63541949,0.014492754,0.998272084,4.799175293
CD_I291848,Robbie Fox,7,Snr,67,70,680000,77,Overs,D71,D99,140,3,10,14,"Fox had a career best average of 75 in 2021, but remained on the fringe in a strong Swans team. I think it will be much the same in 2023.",Never played more than 15 games in a season and always seems to be on the fringe,none,none,none,39,43,62,37,43,94,6,2,110,43, 0 / 13, 2 / 13, 9 / 13, 6 / 13, 0 / 13,0,0,none,0,0,0,none,0,0,none,4,1.222222222,0,none,76.8,0,43,34,80.55555556,-4,76.6,0,68,9,77.41666667,0,74.76923077,74.76923077,45.06666667,53.125,52.36363636,46,50,253,149,444,332,331,309,254,84.2287695,84.2287695,64.56542502,59.97983871,69.44779359,61.91117093,64.1025641,0,29.7025641,-8.058333333,0.761363636,6.363636364,-4,none,11.92307692,6.615384615,5.769230769,0,0,2.230769231,18.37184343,7.169823232,7.289141414,0,0.150252525,2.440656566
CD_I993979,Sam Powell-Pepper,7,Snr,75,80,680000,77,Full,F36,F66,141,3,20,0,"SPP had a career best season, playing all 22 games as a strong bodied forward. After bursting onto the scene 6 years ago, I had him earmarked to be a midfielder for years to come. However, he's found it hard for midfield minutes and bottomed out last season at just 3%. He's clearly not in calculations anymore and been surpassed by Rozee and Butters, so I think that forward role will be him going forward. In that role, it's hard to see him ever averaging much more than 80.",Settled in a forward role last season which produced a career best season but not good enough for Fantasy,none,none,none,20,20,24,18,20,94,-3,0,111,30, 0 / 22, 2 / 22, 16 / 22, 7 / 22, 0 / 22,0,10,none,0,3.6875,5.142857143,none,0,0,none,0,0,0,none,76.77272727,0,74,3,79.54545455,-3,82.4,-5,none,none,79,-2,76.77272727,76.77272727,58.8125,71.90789474,75.21052632,75,71.2,240,135,313,174,135,121,135,105.4814815,94.14715719,90.9178744,97.51962884,92.96727604,100.536193,105.4814815,0,17.96022727,-13.09539474,-3.302631579,0.210526316,3.8,none,9.818181818,6.772727273,4.727272727,0.954545455,1.090909091,3.363636364,11.90174321,10.68112389,4.63541949,0.014492754,0.998272084,4.799175293
CD_I261510,Tom Hawkins,17,Snr,74,75,680000,77,Full,F41,F91,142,3,11,18,"The ever-green 34-year-old full forward is playing as well as ever in real life, however that equates to the mid-70 mark in Fantasy, which isn't enough to consider.",Mid-70s the last 2 and not getting younger,none,none,none,20,18,60,22,6,94,9,-13,117,31, 0 / 25, 4 / 25, 16 / 25, 10 / 25, 0 / 25,0,0,none,0,0,0,none,0,0,none,0,0,0,none,76.81818182,0,78.16666667,-1,75.2,2,80,-3,79.33333333,-2,79.04166667,-2,90.47619048,77.12,75.84,90.47619048,70.20833333,87,75.4,128,132,141,69,162,64,112,94.87459106,81.48774303,78.96709704,94.66865969,75.73714491,94.87459106,80.98818475,-13.35619048,1.28,-14.63619048,20.26785714,-16.79166667,11.6,1.7,8.84,4.28,5.68,3.4,2.68,1.56,11.90174321,10.68112389,4.63541949,0.014492754,0.998272084,4.799175293
CD_I996731,Charlie Curnow,8,Snr,74,79,678000,77,Full,F42,F83,143,3,11,0,"Curnow's return in 2022 was overshadowed by the other remarkable comebacks of Docherty, Sicily and Witts, but he managed to put up career best numbers and win the Coleman after returning from 4 games in 2 years. Prior to his knee issues, he was looking like he may transition to a tall wingman role in the Kouta-mould, a far more Fantasy friendly role. However, given how dominant he was playing as a key forward last year, he's not moving anywhere anytime soon. And a 77 average from a Coleman season suggests he not going to be a Fantasy option in that time.",Remarkable comeback from the Coleman medallist and locked into the key forward role which limits his Fantasy upside,none,none,none,22,21,51,33,21,94,7,0,138,31, 1 / 22, 3 / 22, 15 / 22, 9 / 22, 0 / 22,0,0,0,0,0,0,none,0,0,0,0,0,0,none,76.59090909,0,80.45454545,-3,72.72727273,4,75.6,1,none,none,78.76190476,-2,76.59090909,76.59090909,50.5,zero,65,73.9,71.2,241,136,400,none,213,129,135,86.40776699,83.33333333,63.92405063,zero,84.74576271,82.94051627,86.40776699,0,26.09090909,-14.5,none,-8.9,2.7,26.7,10.5,1.5,5.727272727,0.045454545,2.909090909,1.590909091,11.90174321,10.68112389,4.63541949,0.014492754,0.998272084,4.799175293
