CD_I1004863,Mitchell Hinge,7,Snr,69,70,371800,68,Fair,D89/M141,D136/M194,,10,14,0,"After just 4 games in 6 seasons, Hinge played 17 in 2022 as a tall wingman and mobile defender. He showed some nice flashes, but with an average of 68, I doubt hell come into SuperCoach relevance.",Got his chance on a wing and half back but scoring seems limited,none,none,none,87,88,82,72,8,95,2,-34,93,37, 0 / 17, 0 / 17, 15 / 17, 10 / 17, 0 / 17,0,0,none,none,0,0,none,0,8,none,none,6.533333333,5.4,none,67.52941176,0,65.11111111,3,70.25,-2,71.4,-3,none,none,69.4375,-1,102,67.52941176,31,102,64.5,zero,zero,90,275,513,50,255,none,none,122.8915663,77.61081893,68.18181818,81.3253012,76.22377622,zero,zero,-34.47058824,36.52941176,-71,37.5,none,none,none,14.82352941,77.08960446,34.77459632,2.647058824,2.705882353,4.882352941,25.11622807,80.7235179,28.70226389,3.141985646,2.327352472,7.156419458,Intercepts
CD_I1004938,Gryan Miers,6,Snr,67,71,351200,64,Fair,F89,F138,,10,0,0, ,Scores okay for a small forward but limited in that role,none,none,none,81,84,66,32,57,91,-4,-7,106,5, 0 / 22, 1 / 22, 17 / 22, 14 / 22, 1 / 22,0,0,none,0,0,0,0,0,0,none,0,0,0,0,63.78947368,0,55.44444444,9,71.3,-7,80.2,-16,65,-1,66.76190476,-3,71.23809524,63.95454545,62.6,71.23809524,67.04,zero,none,350,316,315,213,233,none,none,85.22107813,80.13325257,75.66478646,86.51761518,78.53600945,zero,none,-7.283549784,1.354545455,-8.638095238,4.198095238,none,none,none,14.86363636,71.97831196,30.00418056,2.5,2.136363636,0.590909091,20.35798074,70.28924512,43.39027832,3.038980488,4.25614499,1.318991781,Goals
CD_I280944,Jack Ziebell,15,Snr,63,63,356400,65,Full,F101,F200,,18,10,0,"After having one of the most SuperCoach-friendly roles in 2021 where he did what he wanted in the backline to average 108, Ziebell regressed hard in 2022 as he moved to a role in the forward line. He's shown he can play multiple roles across the ground and there's no doubting his commitment to the team, but at 32, I think we've seen the best of him in real life and in SuperCoach.",Not sure what role Clarko will give him but it won't be the one from 2021 so ignore the discount,none,none,none,79,81,88,125,2,92,0,-43,122,21, 1 / 19, 2 / 19, 15 / 19, 12 / 19, 1 / 19,0,0,0,0,0.466666667,0.583333333,0,40,8,40,32.5,2.733333333,3.416666667,0,64.73684211,0,67.61538462,-3,58.5,7,51,14,none,none,67.16666667,-2,107.6190476,64.73684211,107.6190476,48,90.86363636,84.45454545,89.78947368,58,305,23,397,72,90,55,130.9796729,76.15587847,118.3558559,76.37655417,106.3119345,93.66515837,117.6470588,-42.88220551,-42.88220551,59.61904762,-42.86363636,6.409090909,-5.33492823,-4.471395881,13.47368421,67.47517783,44.19703171,2.473684211,2.210526316,0.894736842,20.35798074,70.28924512,43.39027832,3.038980488,4.25614499,1.318991781,Goals
CD_I1017118,Josh Goater,2,Snr,68,95,192700,35,Low,D95/M142,D44/M94,,28,0,0,"It took until Round 23 for Goater to debut but when he did he looked great, using his athletic rebounding skills to score 83. He's one we wish didn't debut so he'd be basement price this season, but priced at 35, he's still very cheap. If he looks good in the preseason and there aren't many other rookie defenders available, then you certainly could pay up.",Looked great in his 1 game but now a premium rookie price,none,none,none,199,72,23,75,72,62,-21,-35,70,70, 0 / 1, 0 / 1, 1 / 1, 0 / 1, 0 / 1,0,0,none,none,0,none,none,0,0,none,none,0,none,none,70,-35,none,none,70,-35,70,-35,none,none,none,none,70,70,none,none,none,none,none,365,242,none,none,none,none,none,103.75,103.75,none,none,none,none,none,0,none,none,none,none,none,none,21,66.66666667,28.57142857,2,3,5,25.11622807,80.7235179,28.70226389,3.141985646,2.327352472,7.156419458,Intercepts
CD_I1008550,Will Day,4,Snr,85,100,362100,66,Unders,D46,D32,,15,17,10,"From such a promising start, Day has had a frustrating few years in the AFL. The lightly-built former first round pick looked at home in his debut season, averaging 72 through 11 matches and was incredibly composed under pressure. We didn't see much of him in his second season due to injury, however he did score 122 and 112 in 2 of his 5 matches. I was hopeful for a big leap last season but it never happened, missing the first 2 rounds for fitness and then averaging just 66 points for the remainder. Hawthorn's defence is very stacked for distribution (Sicily, Scrimshaw, Jiath, Bramble) and Day took a backseat. I'm hoping with a full preseason under his belt, Day can return to form and look more like the player I had earmarked to one day be a top 6 defender.",Hoping for a bounce back after a few down seasons following a promising debut,none,none,none,92,96,73,92,56,93,-2,-13,93,26, 0 / 17, 0 / 17, 14 / 17, 8 / 17, 1 / 17,0,0,none,none,2.785714286,4.875,0,36,20,none,none,13.42857143,10.25,0,65.76470588,0,67.6,-2,63.14285714,3,66.4,0,none,none,68.25,-2,79.4,65.76470588,79.4,71.54545455,none,none,none,273,293,165,211,none,none,none,100,80,86.64987406,90.10989011,none,none,none,-13.63529412,-13.63529412,7.854545455,none,none,none,none,16.05882353,75.70931711,29.95215912,2.470588235,1.941176471,5.588235294,25.11622807,80.7235179,28.70226389,3.141985646,2.327352472,7.156419458,Intercepts
CD_I291351,Jack Gunston,14,Snr,75,75,393700,72,Fair,F53,F115,,18,10,0,"The 31-year-old still has a knack of kicking goals, averaging 2 in return from playing just the 1 game the year prior. He's now at the Lions where he should see more looks than he did at the struggling Hawks, but at his age and role I'd say he'll top out around the 80 mark.",Should see more looks at the Lions but doubt he'll average much over 80,none,none,none,53,56,124,22,5,99,15,-25,136,20, 1 / 16, 4 / 16, 10 / 16, 8 / 16, 1 / 16,0,0,0,0,0,0,0,0,0,0,0,0,0,0,71.5,1,68.2,4,77,-5,85.6,-14,none,none,74.93333333,-3,96.5,71.5,22,81.5625,79.85,95,86.36363636,132,230,523,136,130,50,68,107.4610245,70.15250545,39.24050633,86.18560339,86.28117914,96.43255295,96.04519774,-25,49.5,-59.5625,1.7125,-15.15,8.636363636,-4.59469697,10.75,61.46623903,40.32738095,1.75,1.375,2,20.35798074,70.28924512,43.39027832,3.038980488,4.25614499,1.318991781,Goals
CD_I298470,Shane McAdam,5,Snr,63,63,342500,62,Fair,F102,F201,,10,0,0, ,Scoring limited in the small forward role,none,none,none,87,93,55,88,77,90,-7,-4,111,7, 0 / 15, 1 / 15, 10 / 15, 8 / 15, 1 / 15,0,0,none,0,0,0,0,0,0,none,0,0,0,0,62.2,0,67.5,-6,56.14285714,6,61.25,1,none,none,66.14285714,-4,66,62.2,53,66,zero,none,none,411,341,414,257,none,none,none,85.71428571,82.33151184,67.84101174,85.41458541,zero,none,none,-3.8,9.2,-13,none,none,none,none,10.8,66.3960484,36.42547268,2.2,2.933333333,1.533333333,20.35798074,70.28924512,43.39027832,3.038980488,4.25614499,1.318991781,Goals
CD_I1008154,Matthew Cottrell,5,Snr,58,60,335900,61,Full,M176/F138,M213/F206,,14,10,0, ,18 matches after being delisted was impressive but might find it tough now full strength,none,none,none,93,99,87,59,99,88,-4,0,90,7, 0 / 18, 0 / 18, 17 / 18, 10 / 18, 2 / 18,0,0,none,none,0.235294118,0,0,0,0,none,none,0,0,0,61,0,51,10,67.36363636,-6,69.8,-9,none,none,64.17647059,-3,61,61,49.25,48.8,zero,none,none,459,353,445,393,none,none,none,77.48764996,76.49964714,69.70317298,68.8844086,zero,none,none,0,11.75,0.45,none,none,none,none,14.83333333,77.94161585,29.47191449,1.666666667,1.777777778,0.5,20.35798074,70.28924512,43.39027832,3.038980488,4.25614499,1.318991781,Goals
CD_I1004985,Ben Paton,6,Snr,63,66,345800,63,Full,D112,D161,,10,0,0, ,Returned from a broken leg to play 20 matches but hes a shutdown defender,none,none,none,97,111,90,46,111,90,0,0,115,34, 0 / 20, 1 / 20, 19 / 20, 14 / 20, 0 / 20,0,0,none,0,0,0,none,0,0,none,0,3,2.928571429,none,62.8,0,63.36363636,0,62.11111111,1,80.6,-18,none,none,64.31578947,-1,62.8,62.8,zero,61.57894737,57.84615385,54.66666667,none,445,333,none,292,311,284,none,84.1025641,74.48662103,zero,79.390742,73.86526517,75.38461538,none,0,1.221052632,none,3.732793522,3.179487179,none,none,14.7,77.83393216,32.45729744,2.15,2.4,4.9,25.11622807,80.7235179,28.70226389,3.141985646,2.327352472,7.156419458,Intercepts
CD_I1007881,Wil Powell,6,Snr,86,100,425300,77,Low,D43,D33,,28,29,0,"A sickening ankle injury cut his season to 12 games. Sounds like he should be fine for Round 1. Highly rated, a beautiful kick and found his spot on a half back flank, its just hard to see him becoming a relevant SuperCoach player this season.",Returning from an ankle injury and might need time before he hits his straps,none,none,none,59,61,95,none,47,105,18,-5,119,40, 0 / 12, 3 / 12, 8 / 12, 5 / 12, 1 / 12,0,0,none,0,0,0,0,0,17,none,20,30.5,34.6,8,77.25,0,79.81818182,-3,49,28,none,none,none,none,80.63636364,-4,82.04545455,77.25,82.04545455,66.8,55,43.28571429,none,237,188,150,250,332,323,none,97.04301075,73.19062181,85.53763441,81.1251086,70.68607069,53.36856011,none,-4.795454545,-4.795454545,15.24545455,11.8,11.71428571,none,none,14.66666667,75.68984246,38.14490656,2.166666667,2.416666667,5.5,25.11622807,80.7235179,28.70226389,3.141985646,2.327352472,7.156419458,Intercepts
CD_I1015873,Archie Perkins,3,Snr,74,98,314400,57,Unders,F60,F24,,3,12,0,"The number 9 pick of the 2020 draft has played an impressive 38 games in his first 2 seasons, providing some x-factor around goal and in the air. Hes been tested in the middle at times and looked comfortable, scoring his season high 109 when he had 50% CBAs. The Bombers have a few who run through there, but I think well see more of Perkins in 2023. Hes not cheap enough for me to consider, but with his forward status hes worth keeping an eye on.",A watch on his CBAs in preseason as he looks a player and forward status makes him relevant,none,none,none,111,115,90,154,115,84,-7,0,109,21, 0 / 18, 1 / 18, 17 / 18, 13 / 18, 0 / 18,50,0,none,50,20.17647059,17.76923077,none,0,0,none,0,0,0,none,57.11111111,0,57,0,57.28571429,0,40.75,16,none,none,59.23529412,-2,57.11111111,57.11111111,48.75,none,none,none,none,495,404,450,none,none,none,none,75.90361446,75.90361446,67.70833333,none,none,none,none,0,8.361111111,none,none,none,none,none,12.16666667,68.06823456,32.56363236,1.555555556,2.5,0.888888889,20.35798074,70.28924512,43.39027832,3.038980488,4.25614499,1.318991781,Goals
CD_I1008123,Jake Riccardi,4,Snr,64,68,325600,59,Low,F97,F167,,11,14,0,"For a key position player, Riccardi's marking ability means he is capable of some decent Fantasy scoring. However, he was used more as a forward last year where he doesnt score as well. Still yet to lock down a position in their best 22, hes not an option this season.",Still yet to lock down a position in their best 22,none,none,none,100,105,116,79,60,86,-2,-11,99,24, 0 / 14, 0 / 14, 13 / 14, 10 / 14, 0 / 14,0,10,none,none,5.384615385,6.7,none,0,0,none,none,0,0,none,59.14285714,0,49.66666667,9,66.25,-7,63.75,-5,none,none,61.84615385,-3,69.6,59.14285714,42.28571429,69.6,none,none,none,371,378,486,226,none,none,none,79.63386728,71.31849315,51.61290323,84.38215103,none,none,none,-10.45714286,16.85714286,-27.31428571,none,none,none,none,10.78571429,73.25618359,37.90800936,1.714285714,1.642857143,1.071428571,20.35798074,70.28924512,43.39027832,3.038980488,4.25614499,1.318991781,Goals
CD_I1008282,Xavier O'Neill,5,Snr,61,76,333800,61,Full,M165,M174,,14,13,0,"A fringe midfielder had every chance to succeed in his 4th season given the injuries at West Coast, however he failed to deliver, averaging 59 from 44% CBAs. He might struggle for games with a healthy list this season.",Yet to look a scorer and might struggle with stars returning,none,none,none,106,110,110,90,110,88,-7,0,118,34, 0 / 11, 1 / 11, 10 / 11, 7 / 11, 0 / 11,56,35,none,56,42.4,42.71428571,none,0,0,none,0,0,0,none,60.63636364,0,50.4,11,69.16666667,-8,67.8,-7,none,none,63.3,-2,60.63636364,60.63636364,43,43.4,zero,none,none,464,358,481,413,none,none,none,82.85714286,81.24223602,64.31372549,71.9126506,zero,none,none,0,17.63636364,-0.4,none,none,none,none,14.54545455,67.30900104,39.70846772,2.818181818,4.636363636,2.181818182,28.83718956,70.44127769,46.78371283,3.968325922,5.324824605,6.468673419,Clearances
CD_I1002227,Jack Higgins,6,Snr,68,80,341700,62,Low,F83,F81,,10,26,0,"Higgins has always been on the radar of Fantasy coaches following his monster junior scores which were likened to Fantasy great Tom Rockliff. After being limited to a small forward role with minimal Fantasy impact at Richmond, he arrived at the Saints at the end of 2020 and was flagged for some midfield opportunities, music to all Fantasy coaches' ears. However, this has never eventuated, and he didnt have a single CBA last year. He's always worth monitoring, but there's no way you can start with him based on what weve seen.",The junior stud has been limited to a small forward role at AFL level and hard to see that changing,none,none,none,89,95,61,55,38,89,-6,-16,129,10, 1 / 18, 2 / 18, 15 / 18, 13 / 18, 2 / 18,0,0,0,0,0,0,0,0,0,0,0,0,0,0,62.05555556,0,63,-1,61.3,1,71.6,-10,none,none,65.11764706,-3,78.1,62.05555556,76.44444444,78.1,66.07692308,74.75,none,287,344,187,165,240,151,none,104.2538354,80.49698795,83.78033206,89.61117861,82.10784314,87.58716876,none,-16.04444444,-14.38888889,-1.655555556,12.02307692,-8.673076923,none,none,12.16666667,61.18020324,43.64332785,1.833333333,1.166666667,1.666666667,20.35798074,70.28924512,43.39027832,3.038980488,4.25614499,1.318991781,Goals
CD_I1005577,Sam Draper,7,Snr,76,90,398700,72,Fair,R24,R22,,20,0,0,"Draper finally has a full run at it in 2022, playing all 22 matches after a tough run of injuries and getting himself AFL ready. However, he only managed 72 points from 69% CBAs. Judging from his scoring to date, it's hard to see him making an impact in SuperCoach.",First full season but didn't show enough of a SuperCoach game,none,none,none,20,22,26,18,20,100,4,-4,113,6, 0 / 22, 3 / 22, 15 / 22, 9 / 22, 0 / 22,54,78,none,59,66.26666667,70.11111111,none,0,0,none,0,0,0,none,72.40909091,0,67.36363636,5,77.45454545,-5,74.6,-3,none,none,75.57142857,-4,76.38461538,72.40909091,76.38461538,70.375,zero,zero,zero,302,222,188,218,none,none,none,97.61029412,79.84068627,78.75243665,78.36687307,zero,zero,zero,-3.975524476,-3.975524476,6.009615385,none,none,none,none,9.727272727,65.05148261,70.86481849,3.727272727,1.5,7.227272727,16.13636364,58.46452845,63.64289849,3.5,2.340909091,11.04545455,HO to Adv
CD_I1001195,Izak Rankine,5,Snr,80,97,386000,70,Low,F33,F25,,12,20,0,"Rankine finds himself at Adelaide after 3 years at Gold Coast where he established himself as a dangerous small forward. There's talk of him running through the middle for the Crows, who do lack a bit of excitement amongst Laird, Berry, Crouch and Schoenberg, but I can't see him suddenly bursting into Fantasy relevance.","Talk of mid-time at the Crows, but I'll have to see it to believe it",none,none,none,57,59,129,81,59,97,13,0,110,3, 0 / 18, 3 / 18, 12 / 18, 7 / 18, 0 / 18,0,0,none,2.666666667,0.833333333,0.571428571,none,0,0,none,0,0,0,none,70.11111111,0,66.5,4,74.625,-5,63,7,none,none,74.05882353,-4,70.11111111,70.11111111,55.11111111,69.16666667,zero,none,none,363,241,394,231,none,none,none,83.83838384,69.27083333,61.91117093,73.73737374,zero,none,none,0,15,-14.05555556,none,none,none,none,13.44444444,63.19948893,47.49318917,2.666666667,2.166666667,1.611111111,20.35798074,70.28924512,43.39027832,3.038980488,4.25614499,1.318991781,Goals
CD_I1000932,Tom Doedee,8,Snr,77,80,422300,77,Full,D71,D92,,10,0,0,"Doedee has been a decent scorer for a tall defender on the back of his elite intercept marking ability, averaging over 80 3 times from 2018 to 2021. He was down last year and took a back seat to Jordan Dawson, dropping his average to 77. Thats 8 points below his best, but with Dawson still there I doubt hell get back to the 80s.",Dropped his scoring with Dawson taking over,none,none,none,61,62,135,121,38,104,34,-8,113,26, 0 / 20, 3 / 20, 15 / 20, 6 / 20, 0 / 20,0,0,none,0,0,0,none,10,0,none,7,7.8,8.333333333,none,76.7,0,83.83333333,-7,66,11,57.66666667,19,none,none,79.36842105,-2,85.23809524,76.7,85.23809524,85.22222222,56,82.2,zero,210,191,121,116,329,102,none,207.4074074,63.07363927,72.070626,88.26462766,125.9259259,86.20689655,zero,-8.538095238,-8.538095238,0.015873016,29.22222222,-26.2,none,none,16.15,79.4151265,40.8325884,2,1.7,7.65,25.11622807,80.7235179,28.70226389,3.141985646,2.327352472,7.156419458,Intercepts
CD_I998484,Cameron Zurhaar,7,Snr,67,75,351200,64,Fair,F90,F116,,11,0,0,"Zurhaar is a bash and crash forward who is a powerful athlete and shares some (very minor) similarities with Petracca. A move to the midfield could be on the cards one day, but I don't think it will be anytime soon so he's not an option in SuperCoach.","Strong forward who unless the unlikely midfield move happens, will remain around the 60-mark",none,none,none,81,85,126,73,81,91,5,-1,120,27, 0 / 19, 1 / 19, 15 / 19, 12 / 19, 0 / 19,0,6,none,0,0.4,0.5,none,0,0,none,0,0,0,none,63.78947368,0,62.8,1,64.88888889,-1,65.8,-2,none,none,65.83333333,-2,65.15789474,63.78947368,63.95,62.875,65.15789474,52,43.25,421,317,301,274,250,295,274,83.10591293,69.75731176,80.3768681,72.06632653,79.3401414,59.60451977,52.66579974,-1.368421053,-0.160526316,1.075,-2.282894737,13.15789474,8.75,none,11.89473684,62.30681341,50.6486307,3,1.631578947,1.789473684,20.35798074,70.28924512,43.39027832,3.038980488,4.25614499,1.318991781,Goals
CD_I1008089,Isaac Quaynor,5,Snr,71,80,376700,68,Fair,D84,D93,,10,0,0, ,"Very exciting player to watch, but like most of his team mates, doesn't generate a lot of points under the current game style",none,none,none,82,84,107,116,67,96,10,-7,92,42, 0 / 24, 0 / 24, 22 / 24, 13 / 24, 0 / 24,0,0,none,none,0,0,none,0,0,none,none,1.590909091,1.692307692,none,68.42857143,0,73,-5,61,7,58,10,66,2,69.26086957,-1,74.7,68.125,74.7,72.54545455,60.25,none,none,324,266,204,203,294,none,none,89.26174497,69.86234022,81.50525088,79.83780761,79.61992136,none,none,-6.575,-6.575,2.154545455,12.29545455,none,none,none,13.875,75.42377999,38.6064759,2.083333333,2.916666667,6.25,25.11622807,80.7235179,28.70226389,3.141985646,2.327352472,7.156419458,Intercepts
CD_I1004530,Jacob Wehr,3,Snr,65,70,344100,62,Fair,M155,M195,,10,14,0,"Wehr was recruited as a mature age running defender to fill the void of Heath Shaw retiring and Zac Williams' departure. He finally got his chance in 2022 and was used on a wing, where his neat kicking skills were on display. In terms of SuperCoach though, he's now a mid-only with an awkward price point, so he's not relevant in the game this season.",Debuted as a wingman but now mid-only at an awkward price,none,none,none,102,106,122,100,106,90,-2,-1,89,36, 0 / 10, 0 / 10, 10 / 10, 8 / 10, 0 / 10,0,0,none,none,0,0,none,0,0,none,none,0,0,none,62.5,-1,55.5,7,64.25,-2,57,5,none,none,65.44444444,-3,62.5,62.5,zero,none,none,none,none,448,339,none,none,none,none,none,80.23106547,75.6097561,zero,none,none,none,none,0,none,none,none,none,none,none,12,71.66117216,37.57554945,2.1,3.5,0.8,28.83718956,70.44127769,46.78371283,3.968325922,5.324824605,6.468673419,Clearances
CD_I1004364,Liam Ryan,6,Snr,59,65,295700,54,Low,F129,F171,,10,0,0, ,"His 71 in 2020 was an outlier, expect 50-50 from the gun small forward going forward",none,none,none,138,138,95,66,37,81,-8,-24,92,15, 0 / 17, 0 / 17, 16 / 17, 12 / 17, 0 / 17,0,0,none,none,0,0,none,0,0,none,none,0,0,none,53.70588235,0,45.375,9,61.11111111,-7,66.8,-13,none,none,56.125,-2,78.33333333,53.70588235,62.84615385,78.33333333,62.29166667,63.38461538,none,285,452,312,161,273,229,none,91.73715029,75.26315789,71.84377838,82.79115159,71.07843137,77.88203753,none,-24.62745098,-9.140271493,-15.48717949,16.04166667,-1.092948718,none,none,11,58.61212269,41.32768375,3.352941176,2.294117647,1.117647059,20.35798074,70.28924512,43.39027832,3.038980488,4.25614499,1.318991781,Goals
CD_I1001024,Ned Reeves,5,Snr,67,80,356500,65,Fair,R31,R30,,14,20,0,"Played 12 matches and proved to be a strong hit-out ruckman, but there is a bit of competition there at Hawks with Lynch and Meek vying for the number 1 role.",Bit of competition there at Hawks with Lynch and Meek vying for the number 1 role,none,none,none,25,27,20,12,18,92,-8,-17,95,21, 0 / 12, 0 / 12, 10 / 12, 7 / 12, 1 / 12,86,21,none,none,66.4,64.14285714,21,0,0,none,none,0,0,0,64.75,0,52.57142857,12,81.8,-17,81,-16,none,none,68.72727273,-4,82.4,64.75,82.4,zero,zero,none,none,234,304,148,none,none,none,none,114.7632312,87.5,96.10027855,zero,zero,none,none,-17.65,-17.65,none,none,none,none,none,7.416666667,63.59533985,60.91269841,2.833333333,2.416666667,8,16.13636364,58.46452845,63.64289849,3.5,2.340909091,11.04545455,HO to Adv
CD_I295265,Nick Haynes,12,Snr,72,74,318700,58,Low,D81,D131,,18,10,0,"Haynes had one of his worst outputs in 2022, in both real life and in SuperCoach. It's always hard to rely on defenders who generate a lot of their possessions through intercepts as they don't always come and often the opposition tries to lead them away from the ball. He was also thrown forward at times. He's only 30, so he should be able to bounce back in the right role and system. His best is a long way off what he's priced at, but I wouldn't be buying into that value on what I saw last year.",A long way off his best in 2023 but always hard to rely on interceptors,none,none,none,129,139,101,81,13,85,-3,-40,104,24, 0 / 17, 2 / 17, 15 / 17, 13 / 17, 0 / 17,0,6,none,0,1,1.153846154,none,0,0,none,0,1.133333333,1.307692308,none,57.88235294,0,62.71428571,-5,54.5,4,69,-11,none,none,60,-2,98.35294118,57.88235294,77.33333333,98.35294118,88.30434783,77.125,76.31578947,110,394,179,62,79,142,117,110.5820106,71.65354331,87.58660508,99.12367725,93.89077289,84.03755869,86.06060606,-40.47058824,-19.45098039,-21.01960784,10.04859335,11.17934783,0.809210526,-7.350877193,14.17647059,68.09624315,29.78289915,2.352941176,0.823529412,4.823529412,25.11622807,80.7235179,28.70226389,3.141985646,2.327352472,7.156419458,Intercepts
CD_I297473,Jake Kelly,10,Snr,61,64,332200,60,Fair,D125,D178,,10,0,0, ,General defender who doesn't generate enough SuperCoach points to be relevant,none,none,none,116,127,136,127,66,88,7,-15,101,20, 0 / 21, 1 / 21, 19 / 21, 14 / 21, 0 / 21,0,0,none,0,0,0,none,9,0,none,9,0.368421053,0.5,none,60.33333333,0,55.3,5,64.90909091,-5,55.6,4,none,none,62.35,-2,74.81818182,60.33333333,68.3,57.66666667,74.81818182,67.21052632,60.20833333,321,366,256,338,168,196,212,87.71181925,63.02349336,70.74527253,56.74904943,78.54630715,74.33217189,70.46263345,-14.48484848,-7.966666667,10.63333333,-17.15151515,7.607655502,7.002192982,8.308333333,14.28571429,86.31255553,26.62439848,2.523809524,1.285714286,5.095238095,25.11622807,80.7235179,28.70226389,3.141985646,2.327352472,7.156419458,Intercepts
CD_I1006127,Rhylee West,5,Snr,68,80,363800,66,Fair,F84,F82,,10,14,0,"After 9 games in 3 seasons, West finally got his chance in 2022 and calved out a nice role as a small pressure forward. West was a highly touted inside midfielder as a junior, but with the depth of the midfield at the Dogs, he looks like he's going to continue in the forward role. While that's the case, he won't be a factor in SuperCoach.",Found a spot as a small forward but unlikely he'll move into the middle anytime soon,none,none,none,74,76,91,143,76,93,2,0,121,23, 1 / 13, 1 / 13, 12 / 13, 6 / 13, 0 / 13,0,0,0,0,1.416666667,0,none,0,0,0,0,0,0,none,66.07692308,0,68,-2,65.22222222,1,45,21,none,none,69.66666667,-4,66.07692308,66.07692308,7.5,57.5,59,none,none,410,288,530,340,303,none,none,84.96538081,75.66765579,24.16666667,70.97791798,58.56450903,none,none,0,58.57692308,-50,-1.5,none,none,none,12.46153846,70.96279058,45.50118424,2.307692308,4.076923077,0.846153846,20.35798074,70.28924512,43.39027832,3.038980488,4.25614499,1.318991781,Goals
CD_I998647,Mason Cox,9,Snr,58,58,335100,61,Overs,F139/R37,F229/R53,,20,14,0,"Cox played 18 games last season in an important forward/ruck role and looked a favourite of McRaes. With McStay arriving, I think he'll take that forward/ruck role and we might not see as much of Cox in 2023.",McStay might take the forward/ruck role and we won't see as much of Cox,none,none,none,94,106,35,95,82,88,-12,-3,109,19, 0 / 18, 1 / 18, 17 / 18, 13 / 18, 3 / 18,42,23,none,42,38.23529412,38.61538462,34,0,0,none,0,0,0,0,60.86666667,0,59,2,62.11111111,-1,60,1,50.33333333,11,61.47058824,0,64.45833333,59.11111111,50.57142857,56.81818182,54.07142857,64.45833333,55.44444444,427,379,434,346,342,216,234,91.64513351,89.14728682,68.33976834,56.5380493,61.11580727,70.14051522,80.10471204,-5.347222222,8.53968254,-6.246753247,2.746753247,-10.38690476,9.013888889,-3.737373737,8.444444444,60.61006894,66.00777309,3.111111111,2,0.388888889,20.35798074,70.28924512,43.39027832,3.038980488,4.25614499,1.318991781,Goals
CD_I997933,Griffin Logue,7,Snr,75,85,410200,75,Full,D74/F54,D76/F62,,10,0,0,"Former pick 8 is now at North where he'll likley play as a shut down defender. Outside of his under 18s season where he had a run in the midfield, he hasn't shown enough to suggest he's going to be a SuperCoach option","New team, same shut down role",none,none,none,65,70,151,35,70,102,35,4,125,34, 1 / 20, 2 / 20, 17 / 20, 9 / 20, 0 / 20,0,0,0,0,2.294117647,0,none,0,0,0,0,0,0,none,74.5,1,76.5,-2,72,3,84.5,-10,42,33,73.21052632,2,71.25,71.25,58.8125,70.2,62.6,zero,43.23076923,349,234,356,223,269,none,275,76.61290323,59.89247312,52.90498975,44.80651731,53.52564103,zero,54.41741357,0,12.4375,-11.3875,7.6,19.36923077,none,none,12.55,81.78307263,48.3392128,1.95,1.75,4,25.11622807,80.7235179,28.70226389,3.141985646,2.327352472,7.156419458,Intercepts
